id,title,artist,duration
S00001,"Broken Word of Ice","Blaze Apex",415
S00002,"Remembered Wind in the Rain","Captain Blaze",318
S00003,"Stormy Shadow","Ghost Zephyr",296
S00004,"Cloudy City","Big Crest",319
S00005,"Remembering the Sea","Captain Fable",256
S00006,"Forgetting the Light","Brother Tide",280
S00007,"Running Ice of Silver","Demon Apex",323
S00008,"Remembered Star in the Forest","Big Echo",288
S00009,"Empty Tree in the Beat","Aero Zenith",271
S00010,"Ethereal Room","Agent Storm",185
S00011,"Dreaming Of the Wind","Captain Echo",135
S00012,"Dancing With the Silence","The Apex",359
S00013,"Waiting Gate","Nova Phoenix",271
S00014,"Silent Sun in the Sun","Captain Frequency",282
S00015,"Cosmic Rhythm of Picture","Zephyr Pulse",454
S00016,"Hidden Rain","Lil Wave",440
S00017,"Crimson Town of Dust","Lil Rhythm",268
S00018,"Lunar Gold","Sir Wave",130
S00019,"Hiding From the Picture","Sir Fable",202
S00020,"Luminous Wave of Page","Brother Beat",401
S00021,"Cloudy Illusion","Big Nova",237
S00022,"Hiding From the Forest","Captain Blaze",445
S00023,"Infinite Heart of Sky","Rhythm Sirius",469
S00024,"Wild Dream in the Page","The Cascade",360
S00025,"Sunset Flower","Sir Aero",206
S00026,"Neon Voice of Rose","Spirit Phantom",420
S00027,"Lunar Night in the Dream","Sonic Solaris",407
S00028,"Forgetting the Bridge","Pulse Aero",225
S00029,"Midnight Sun in the Day","Lil Lyra",284
S00030,"Empty Ice","Big Beat",162
S00031,"Screaming Whisper of Bridge","Captain Vega",425
S00032,"Fallen Forest in the Stone","Lady Solaris",310
S00033,"Returning Silence of Town","Demon Harmony",345
S00034,"Silver Dream of Silver","Sister Apex",304
S00035,"Sailing On the Road","Melody Vibe",291
S00036,"Dreaming Of the Melody","DJ Frequency",398
S00037,"Remembering the Phoenix","Sister Luna",418
S00038,"Leaving Picture of Rhythm","Rhythm Sirius",355
S00039,"Broken Silver","Demon Vibe",250
S00040,"Lunar Water","Sonic Apex",443
S00041,"Lunar Night of Wave","Sir Climax",281
S00042,"Glowing Mountain of Picture","Apex Wave",272
S00043,"Velvet Rose in the Wind","Big Cascade",333
S00044,"Golden Room","Phantom Orion",159
S00045,"Windy Soul in the Story","Lady Wave",208
S00046,"Walking In the Shadow","Climax Aero",195
S00047,"Returning Street","Brother Rhythm",127
S00048,"Cloudy Heart","Big Ghost",219
S00049,"Walking In the Ocean","Demon Echo",224
S00050,"Dancing Mirror of Dust","DJ Demon",201
S00051,"Hidden Firefly in the Light","MC Wave",329
S00052,"Fallen Sun of Line","Apex Nova",337
S00053,"Running Sky in the Night","Lady Nova",458
S00054,"Golden River of Moon","Climax Aero",370
S00055,"Sunset Town of Ocean","Vega Vega",441
S00056,"Lost Sun of Valley","Spirit Orion",454
S00057,"Singing Under the Gold","The Specter",152
S00058,"Flying Above the Sun","The Luna",353
S00059,"Running Picture in the Dust","The Aero",346
S00060,"Ocean Word in the Water","Luna Legend",312
S00061,"Dying Silence of Valley","Legend Orion",192
S00062,"Faded Wave in the River","Lil Harmony",123
S00063,"Dying Stone","The Wave",206
S00064,"Living Illusion","Sir Frequency",340
S00065,"Remembering the Gold","Sonic Solaris",310
S00066,"Cloudy Song","Captain Vibe",441
S00067,"Stormy Night","The Frost",352
S00068,"Leaving Day of Tree","Sir Cascade",159
S00069,"Walking In the Page","The Sonic",248
S00070,"Crying Heart in the Voice","Sister Drift",124
S00071,"Screaming Word in the Window","Captain Fable",344
S00072,"Chasing the Rose","Vega Phantom",344
S00073,"Singing Under the Phoenix","Lil Rhythm",440
S00074,"Sailing On the Page","Big Zenith",342
S00075,"Sunrise Town in the Ice","Tide Frost",378
S00076,"Losing the House","Angel Rhythm",431
S00077,"Hiding From the Rhythm","Sirius Ghost",220
S00078,"Shadowy Water of Light","MC Wave",329
S00079,"Wild Heart in the Ice","Frequency Cascade",350
S00080,"Chasing Room of Dust","Captain Vega",322
S00081,"Winter Path in the Mountain","Specter Solaris",284
S00082,"Sunrise Melody","Angel Rhythm",127
S00083,"Waiting Room","The Luna",389
S00084,"Singing Under the City","Phantom Phoenix",310
S00085,"Dreamy Star of Moon","Beat Phantom",233
S00086,"Hiding From the Rose","DJ Ghost",224
S00087,"Flying Above the Word","Melody Ghost",255
S00088,"Sunrise Road of Soul","Agent Phoenix",290
S00089,"Screaming City in the Song","The Melody",256
S00090,"Rainy Story","The Fable",415
S00091,"Solar Rhythm of Door","Agent Pulse",209
S00092,"Silver Door of Room","Solaris Vibe",193
S00093,"Watching the Beat","Lyra Aero",391
S00094,"Crying Firefly","Spirit Tide",146
S00095,"Crying Rain in the Echo","Sir Fable",340
S00096,"Lost Song of Whisper","Shadow Angel",466
S00097,"Crystal Illusion in the Door","Lady Tide",149
S00098,"Finding the Rain","Orion Orion",223
S00099,"Losing the Water","Sonic Solaris",377
S00100,"Rainy Wind in the Dream","Captain Sirius",409
S00101,"Waiting Door","Ghost Pulse",202
S00102,"Returning Sun of Sound","Captain Zephyr",307
S00103,"Losing the Gate","Captain Phoenix",437
S00104,"Dancing With the Town","Aero Zenith",150
S00105,"Whispering Window in the Light","Big Cascade",443
S00106,"Walking In the Voice","Zephyr Specter",433
S00107,"Rising Wave of Sun","Cascade Angel",187
S00108,"Returning Light in the Story","Lyra Luna",450
S00109,"Stormy Song of Gold","Captain Ghost",401
S00110,"Fallen Night in the Gate","Zephyr Pulse",408
S00111,"Windy Mountain","Agent Sirius",194
S00112,"Summer Valley of Picture","Captain Phantom",399
S00113,"Spring Door in the Gate","Crest Crest",416
S00114,"Velvet Firefly in the Tree","Specter Sirius",155
S00115,"Lost Dust in the Rose","DJ Legend",309
S00116,"Fallen Sky of Flower","Solaris Lyra",192
S00117,"Windy Light of Street","Specter Solaris",186
S00118,"Infinite Mountain","Sirius Luna",205
S00119,"Neon Soul of Sun","DJ Sirius",146
S00120,"Crystal Stone in the Room","Sister Luna",453
S00121,"Fallen Picture","Agent Zenith",216
S00122,"Silver Door","Demon Echo",225
S00123,"Light Gold","Captain Wave",234
S00124,"Midnight Line in the Valley","Myth Specter",186
S00125,"Summer Voice","Nova Phoenix",346
S00126,"Singing House of Story","MC Zenith",200
S00127,"Sailing On the Road (Mix 43)","Lady Shadow",441
S00128,"Forgotten Forest in the Shadow","Brother Angel",414
S00129,"Serene Silence","Storm Climax",131
S00130,"Hidden Tree","Phoenix Solaris",377
S00131,"Singing Under the Silver","Agent Sirius",411
S00132,"Crimson Sun in the Flower","Vega Sonic",343
S00133,"Dying Mountain of Light","Frost Apex",249
S00134,"Summer Day of Star","Lyra Aero",448
S00135,"Dying Story","Lil Echo",347
S00136,"Dark Illusion of Rose","Spirit Drift",360
S00137,"Screaming Heart","Harmony Apex",386
S00138,"Singing Under the Door","The Angel",152
S00139,"Chasing the Soul","Sister Atlas",165
S00140,"Ethereal Bridge of River","Apex Cascade",124
S00141,"Chasing Door of Room","Spirit Orion",452
S00142,"Rising Day of Silver","Captain Echo",164
S00143,"Crystal Fire in the Room","Harmony Apex",188
S00144,"Dying Sound of Street","DJ Zephyr",182
S00145,"Cloudy Rose","Spirit Tide",258
S00146,"Forgetting the Book","Demon Zephyr",173
S00147,"Sunrise Bridge of Story","Apex Phantom",212
S00148,"Sunrise Phoenix in the Book","Apex Beat",137
S00149,"Waiting Night in the Beat","Lady Phantom",147
S00150,"Singing Mirror in the Rhythm","Agent Wave",158
S00151,"Summer Town of Bridge","Sister Apex",232
S00152,"Walking In the Stone","Spirit Shadow",400
S00153,"Dancing Voice of Glass","Storm Glide",428
S00154,"Dying Heart","Nova Phoenix",148
S00155,"Remembered Glass of Voice","Lil Rhythm",472
S00156,"Starry House of Forest","Brother Specter",288
S00157,"Wild Rose of Whisper","Lady Aero",194
S00158,"Whispering Gate of Dust","Captain Frost",160
S00159,"Haunted Wind of Gate","DJ Drift",393
S00160,"Golden Glass of Beat","The Zephyr",245
S00161,"Listening To the Firefly","Storm Atlas",458
S00162,"Singing Day in the Dust","Crest Crest",346
S00163,"Mystic Ocean of Glass","The Blaze",328
S00164,"Remembering the Firefly","Vibe Phantom",384
S00165,"Bitter Ocean in the Gold","Drift Fable",161
S00166,"Empty Soul of Book","Frequency Zenith",408
S00167,"Watching the Silence","Sister Aero",164
S00168,"Singing Street of Dream","DJ Storm",413
S00169,"Spring Rose of Light","Sir Glide",251
S00170,"Screaming Sky","Specter Solaris",330
S00171,"Losing the Ocean","Ghost Zephyr",256
S00172,"Chasing the Ice","Shadow Atlas",328
S00173,"Flying Above the Street","Solaris Atlas",309
S00174,"Dreaming Of the Tree","Demon Crest",314
S00175,"Remembering the Door","DJ Blaze",420
S00176,"Dreamy Song","Solaris Glide",433
S00177,"Remembering the Rose","MC Phantom",247
S00178,"Singing Under the Melody","Vibe Zenith",162
S00179,"Silver Word in the Stone","Sirius Climax",322
S00180,"Secret Illusion","Agent Pulse",274
S00181,"Chasing Flower","Lady Atlas",409
S00182,"Waiting Melody of Sun","Luna Lyra",287
S00183,"Waiting For the Street","Nova Phoenix",272
S00184,"Returning Night in the Window","MC Orion",285
S00185,"Golden Stone of Stone","Frost Apex",306
S00186,"Singing Window of Book","Demon Phoenix",157
S00187,"Finding Beat","Lady Wave",180
S00188,"Dreaming Of the Sky","Spirit Shadow",449
S00189,"Flying Above the Day","The Myth",412
S00190,"Finding the Mountain","Sonic Solaris",145
S00191,"Walking In the Road","Angel Luna",469
S00192,"Silent River","Wave Apex",475
S00193,"Flying Sun","Rhythm Lyra",271
S00194,"Electric Street in the Room","Captain Lyra",373
S00195,"Running Through the Voice","Brother Phantom",177
S00196,"Chasing the Day","Brother Beat",321
S00197,"Drifting Stone","Agent Orion",401
S00198,"Losing the Mirror","Agent Zenith",349
S00199,"Ocean Sea of Bridge","DJ Demon",468
S00200,"Listening To the Voice","Storm Drift",384
S00201,"Glowing Door of Picture","DJ Melody",406
S00202,"Hidden Song of Illusion","Captain Drift",265
S00203,"Autumn Song of Forest","Vega Vega",281
S00204,"Autumn Wind in the Path","MC Orion",480
S00205,"Glowing Sea in the Water","Zephyr Glide",329
S00206,"Forgetting the Water","Specter Apex",360
S00207,"Singing Road of Path","Nova Ghost",205
S00208,"Winter Ice in the Heart","Captain Fable",477
S00209,"Losing the Wave","Sir Frost",370
S00210,"Ethereal Book of House","Sister Atlas",213
S00211,"Waiting Path of Sky","Captain Frequency",361
S00212,"Dark Dust","Rhythm Glide",227
S00213,"Crying House of Stone","The Aero",137
S00214,"Bitter Gold of Sound","Captain Lyra",441
S00215,"Singing Under the Door (Mix 17)","Phoenix Pulse",217
S00216,"Secret Wave in the Star","Shadow Atlas",367
S00217,"Dreaming Of the Street","The Tide",422
S00218,"Windy Page in the Bridge","Tide Shadow",207
S00219,"Bitter Page of Bridge","Phantom Orion",235
S00220,"Rising Bridge","Apex Spirit",260
S00221,"Spring Valley of Rose","Demon Harmony",257
S00222,"Serene Wind of Flower","Vega Phantom",213
S00223,"Sunrise Phoenix","Sir Cascade",383
S00224,"Listening To the Picture","MC Orion",454
S00225,"Walking In the Moon","Agent Shadow",398
S00226,"Dreaming Of the Bridge","Apex Shadow",341
S00227,"Flying Above the Soul","Shadow Atlas",173
S00228,"Velvet Street","Agent Atlas",379
S00229,"Dancing With the River","Aero Apex",233
S00230,"Singing Wave of Line","Melody Vibe",179
S00231,"Forgotten Silver in the Fire","The Nova",328
S00232,"Broken Gate","Brother Cascade",176
S00233,"Cloudy Soul","Cascade Vibe",146
S00234,"Stormy Whisper","Frost Orion",395
S00235,"Stormy Forest of Mountain","Frost Zephyr",232
S00236,"Lost Door of City","Storm Wave",238
S00237,"Sunset Mirror of Room","MC Lyra",441
S00238,"Stormy Flower","Brother Phantom",451
S00239,"Watching the Dust","Spirit Tide",262
S00240,"Dancing Story of Firefly","Sir Wave",458
S00241,"Luminous Story in the Path","Phantom Orion",257
S00242,"Golden Ocean of Line","Lil Climax",288
S00243,"Faded Water of Light","Harmony Frequency",299
S00244,"Dreaming Of the Rain","Captain Vega",211
S00245,"Finding the Mirror","Lyra Glide",135
S00246,"Hiding From the House","Brother Spirit",207
S00247,"Walking In the Book","The Harmony",301
S00248,"Dancing Silver","Melody Crest",224
S00249,"Dreaming Of the Heart","Storm Glide",410
S00250,"Silent Room of Fire","Luna Lyra",473
S00251,"Dark Valley in the Heart","Brother Frequency",477
S00252,"Spring Day of Gold","Captain Frost",303
S00253,"Burning Stone in the Rhythm","Vega Phantom",379
S00254,"Forgotten Picture","Brother Lyra",184
S00255,"Haunted Sky","Lady Phantom",475
S00256,"Glowing Dust","Frequency Atlas",260
S00257,"Whispering Melody of Whisper","Brother Beat",250
S00258,"Autumn House","Rhythm Glide",185
S00259,"Dancing With the Ocean","Lil Harmony",350
S00260,"Searching Song","Vibe Zenith",475
S00261,"Running Through the Whisper","Brother Phoenix",238
S00262,"Singing Under the Book","Specter Drift",379
S00263,"Glowing Book of Ice","Captain Atlas",322
S00264,"Chasing Story","The Pulse",280
S00265,"Singing Gold in the Soul","Sister Demon",473
S00266,"Infinite Silver","Sister Demon",150
S00267,"Infinite Path in the Rhythm","DJ Sonic",228
S00268,"Flying Above the Picture","Apex Sirius",253
S00269,"Fallen Whisper of Page","Spirit Orion",243
S00270,"Running Through the Shadow","Sonic Apex",131
S00271,"Searching Stone of Silence","The Beat",208
S00272,"Cloudy Forest","Glide Drift",338
S00273,"Golden Line in the Window","Shadow Angel",165
S00274,"Flying Star of Door","Sir Harmony",439
S00275,"Golden Whisper","Big Beat",280
S00276,"Summer Sea","Cascade Vega",391
S00277,"Solar Fire","Ghost Pulse",150
S00278,"Fallen Illusion","DJ Frequency",283
S00279,"Flying Tree in the Glass","Big Myth",188
S00280,"Chasing the Dust","Captain Vega",324
S00281,"Walking In the Window","Atlas Sonic",334
S00282,"Drifting Melody of Mirror","Phoenix Specter",204
S00283,"Sunset Firefly","The Lyra",159
S00284,"Finding Rhythm of House","Agent Sonic",171
S00285,"Crystal Stone of Wave","Sonic Fable",200
S00286,"Ethereal Ocean of Word","Lil Pulse",157
S00287,"Rainy Street in the Road","The Storm",197
S00288,"Finding Road in the Heart","The Melody",392
S00289,"Flying Picture","Phantom Phoenix",280
S00290,"Singing Under the Night","Sir Lyra",297
S00291,"Crying Moon in the Gold","DJ Sonic",185
S00292,"Dreaming Of the Melody (Mix 21)","Apex Nova",214
S00293,"Cosmic Silver of Tree","Harmony Apex",207
S00294,"Burning Picture","Harmony Zenith",182
S00295,"Finding the River","Nova Beat",336
S00296,"Walking In the Silence","Big Cascade",339
S00297,"Empty Wind of Line","Brother Storm",480
S00298,"Solar Stone","Tide Frost",447
S00299,"Singing Silence of Silence","Captain Ghost",149
S00300,"Forgetting the Street","Captain Rhythm",471
S00301,"Secret Beat in the Silence","Angel Rhythm",284
S00302,"Empty Silver","Tide Frost",156
S00303,"Waiting Flower in the Whisper","Atlas Luna",196
S00304,"Losing the Sound","Sir Shadow",152
S00305,"Flying Rose of Page","Crest Vega",347
S00306,"Singing Under the Forest","DJ Melody",465
S00307,"Golden Bridge of Dust","Melody Ghost",363
S00308,"Haunted Town of Story","Lil Nova",207
S00309,"Secret Voice","Storm Wave",208
S00310,"Forgetting the Window","Brother Cascade",425
S00311,"Forgetting the House","Sir Wave",310
S00312,"Stormy Line in the Firefly","Lady Blaze",194
S00313,"Lunar Room in the Wave","Frequency Apex",352
S00314,"Lost Path of Wave","The Sirius",160
S00315,"Whispering Door in the Rose","Tide Apex",312
S00316,"Forgetting the Book (Mix 7)","The Phoenix",164
S00317,"River Fire in the Wave","The Frost",241
S00318,"Sunset Wave of Sea","Tide Shadow",314
S00319,"Leaving Road in the Light","Shadow Angel",458
S00320,"Wild Moon of Melody","The Pulse",132
S00321,"Watching the Sea","Spirit Phantom",397
S00322,"Losing the Dust","Phoenix Pulse",137
S00323,"Burning Melody of Door","Captain Frequency",356
S00324,"Fallen Night of Rain","Captain Atlas",218
S00325,"Mystic Tree of Dust","DJ Zephyr",354
S00326,"Sunset Line of Light","MC Apex",208
S00327,"Burning Whisper","Sister Drift",225
S00328,"Crimson Song","Storm Specter",436
S00329,"Remembering the Star","The Echo",234
S00330,"Sunrise Page","Demon Harmony",206
S00331,"Singing Wave in the Moon","Crest Vega",209
S00332,"Dying Storm","Captain Ghost",430
S00333,"Waiting For the Sky","Big Beat",465
S00334,"Glowing Sea","Myth Atlas",366
S00335,"Drifting Room of Town","Rhythm Beat",478
S00336,"Chasing Forest in the Path","Rhythm Cascade",134
S00337,"Forgetting the River","Solaris Lyra",277
S00338,"Spring City of Firefly","Apex Solaris",144
S00339,"Watching the Wave","Luna Beat",466
S00340,"Spring Firefly of Town","The Shadow",278
S00341,"Dark Dream in the Road","Drift Harmony",189
S00342,"Sunset Path","MC Frequency",292
S00343,"Faded Song of Rhythm","Sir Phoenix",397
S00344,"Forgetting the Town","MC Zenith",307
S00345,"Hiding From the Garden","Beat Harmony",159
S00346,"Dark Wind of Mountain","Lil Lyra",459
S00347,"Whispering Garden in the Phoenix","Captain Frost",324
S00348,"Chasing the Mountain","Solaris Phantom",255
S00349,"Flying Above the Ice","Shadow Glide",192
S00350,"Mystic Fire of Room","Wave Drift",324
S00351,"Ocean Page of Sky","Agent Sonic",355
S00352,"River Sound in the Page","Storm Frost",461
S00353,"Dancing Echo","Glide Drift",127
S00354,"Singing Under the Storm","Big Nova",344
S00355,"Watching the Book","Brother Tide",262
S00356,"Serene Valley","Spirit Specter",475
S00357,"Sunset Sea of Mountain","Big Sirius",244
S00358,"Rising Firefly of Rain","Lil Vega",331
S00359,"Lost Phoenix in the Garden","Sonic Fable",382
S00360,"Stormy Forest in the Silver","Lady Shadow",217
S00361,"Spring Phoenix","Lyra Lyra",187
S00362,"Chasing the Rhythm","Captain Sirius",441
S00363,"Sailing On the Book","Orion Orion",273
S00364,"Cosmic Dust in the Line","Sirius Specter",349
S00365,"Midnight Road in the Gold","Captain Zephyr",365
S00366,"Drifting Storm in the Wind","Lyra Aero",179
S00367,"Wild City","MC Frequency",321
S00368,"Light Rain in the Flower","Sister Beat",418
S00369,"Laughing Flower in the Sound","Rhythm Myth",429
S00370,"Forgotten Day","Phoenix Crest",432
S00371,"Crystal Tree in the Sea","Cascade Vibe",389
S00372,"Hiding From the Beat","Pulse Aero",296
S00373,"Summer Beat","Lady Phoenix",311
S00374,"Lunar Picture","Apex Cascade",191
S00375,"Hidden Song of City","Beat Apex",227
S00376,"Light Rose in the City","DJ Demon",466
S00377,"Silent Whisper of Silence","Melody Phoenix",318
S00378,"Chasing the Forest","Sir Frost",399
S00379,"Running Through the Mirror","Sirius Shadow",280
S00380,"Lunar Page of Mirror","MC Frequency",128
S00381,"Autumn Forest in the Line","Storm Frost",410
S00382,"Empty City in the Sea","Brother Lyra",205
S00383,"Remembered Song","Captain Wave",165
S00384,"Windy Day","The Phoenix",351
S00385,"Rising Fire of Gate","Cascade Wave",197
S00386,"Running Through the Star","Lil Melody",416
S00387,"Dreamy Forest of River","Solaris Harmony",272
S00388,"Hidden Day of Wind","Lady Vega",196
S00389,"Sunrise Echo of Dust","Frost Zephyr",472
S00390,"Chasing the Whisper","Lil Echo",153
S00391,"Stormy Echo in the Phoenix","Lil Glide",299
S00392,"Burning Room","Big Echo",215
S00393,"Forgetting the Room","The Phantom",130
S00394,"Running Glass in the Rhythm","Angel Storm",169
S00395,"Starry Water","Frequency Zenith",252
S00396,"Drifting Light in the Flower","Captain Frost",225
S00397,"Waiting For the Heart","Nova Phoenix",250
S00398,"Singing Sun","Sister Beat",464
S00399,"Running Page of Dust","Tide Apex",152
S00400,"Chasing the Sea","Pulse Sirius",141
S00401,"Running Through the Silence","Apex Beat",315
S00402,"Serene Picture of Night","Legend Lyra",204
S00403,"Hiding From the Room","Climax Spirit",394
S00404,"Rising Dream in the Heart","Crest Vibe",355
S00405,"Lost Window","DJ Orion",362
S00406,"Lost Ice of Melody","Spirit Shadow",176
S00407,"Waiting For the Day","Rhythm Cascade",122
S00408,"Drifting Story of Tree","Blaze Apex",393
S00409,"Ethereal Voice","Sonic Apex",359
S00410,"Screaming Voice of Sea","Sir Harmony",263
S00411,"Drifting Dream of Mountain","Vibe Luna",456
S00412,"Chasing Water in the Page","Legend Lyra",301
S00413,"Laughing Illusion","Crest Vega",239
S00414,"Whispering Glass of Dust","Aero Apex",301
S00415,"Waiting City of Ocean","Luna Lyra",372
S00416,"Light Dream of Mountain","Brother Spirit",351
S00417,"Crystal Gate","Shadow Angel",181
S00418,"Midnight Forest","Harmony Frequency",450
S00419,"Finding the Stone","DJ Phantom",185
S00420,"Returning Forest of Gold","The Luna",275
S00421,"Windy Street","Lil Vega",134
S00422,"Living Dust","The Crest",225
S00423,"Finding the Light","MC Frequency",248
S00424,"Secret Wind of Gold","The Luna",240
S00425,"River Night in the Garden","Wave Drift",141
S00426,"Windy Sea in the Dust","Captain Sonic",271
S00427,"Shadowy Gate","Melody Crest",426
S00428,"Flying Above the Song","Agent Atlas",228
S00429,"Velvet Tree","The Wave",461
S00430,"Dying Ice","DJ Apex",271
S00431,"Crimson Silence","Sir Spirit",292
S00432,"Electric Soul","Vega Atlas",137
S00433,"Watching the Sky","DJ Frequency",217
S00434,"Broken Beat of Road","Big Vibe",470
S00435,"Waiting Silence in the Water","Melody Phoenix",445
S00436,"Faded Forest in the Ice","Sister Drift",430
S00437,"Windy Tree in the Sun","Frost Zephyr",241
S00438,"Bitter House in the Room","Beat Harmony",385
S00439,"Walking In the Shadow (Mix 40)","Big Ghost",294
S00440,"Sailing On the Mountain","Sir Frost",337
S00441,"Ethereal Silence in the Dust","Lil Frost",230
S00442,"Singing Under the Heart","Brother Storm",149
S00443,"Laughing Firefly in the Town","Brother Specter",467
S00444,"Dreamy Water","The Luna",479
S00445,"Walking In the Rhythm","Specter Apex",472
S00446,"Fallen Forest of Fire","The Solaris",470
S00447,"Golden Moon of Sound","Brother Lyra",442
S00448,"Silver Phoenix of Tree","Lyra Lyra",250
S00449,"Forgotten Sea of Silver","Sister Atlas",379
S00450,"Sweet Door in the Beat","Phantom Echo",319
S00451,"Empty Star of Moon","Cascade Aero",351
S00452,"Spring Stone of Shadow","Sister Demon",244
S00453,"Finding the Flower","Sister Drift",470
S00454,"Waiting For the Wind","Zephyr Specter",203
S00455,"Light Rhythm","Sir Vibe",268
S00456,"Fallen Day of Song","The Melody",476
S00457,"Secret House in the Sun","The Myth",181
S00458,"Running Through the Town","Agent Pulse",162
S00459,"Rainy Heart","Lady Demon",154
S00460,"Losing the Forest","DJ Sonic",272
S00461,"Chasing Tree of Wind","Vega Frequency",438
S00462,"Dark Mountain","Lil Harmony",205
S00463,"Screaming City in the Town","Sir Echo",441
S00464,"Finding Valley","The Crest",401
S00465,"Dreaming Of the Sound","Lil Storm",198
S00466,"Fallen Shadow of Phoenix","Crest Vega",395
S00467,"Cloudy Fire","Pulse Orion",462
S00468,"Flying Wave in the Star","Vibe Frost",341
S00469,"Dancing Gate","Tide Frost",463
S00470,"Whispering Firefly in the Rhythm","Demon Crest",171
S00471,"Broken Tree of Wave","Sonic Apex",411
S00472,"Spring Fire in the Line","Apex Spirit",440
S00473,"Neon Storm","Sister Beat",225
S00474,"Neon Whisper in the Rain","Vibe Frost",135
S00475,"Whispering Night in the Illusion","The Vega",420
S00476,"Dancing With the Beat","Captain Fable",387
S00477,"Waiting Phoenix","Drift Phoenix",180
S00478,"Serene Ice","Nova Phoenix",354
S00479,"Hidden Silence","Climax Aero",217
S00480,"Spring Fire of Line","The Spirit",291
S00481,"Light Beat in the City","Pulse Sirius",332
S00482,"Forgetting the Rain","Nova Ghost",386
S00483,"Chasing the Dream","The Fable",415
S00484,"Living Silence of Phoenix","The Frequency",217
S00485,"Light Book of Fire","Demon Crest",294
S00486,"Watching the Line","Lil Glide",281
S00487,"Living Garden","Sirius Specter",399
S00488,"Finding the Rose","The Demon",157
S00489,"Mystic Town","Sir Cascade",148
S00490,"Remembering the House","Spirit Tide",253
S00491,"Serene Garden in the Street","Specter Sirius",235
S00492,"Ocean Book","Phoenix Solaris",139
S00493,"Mystic Fire","Agent Phantom",296
S00494,"Dancing With the Gold","Rhythm Glide",399
S00495,"Silver Rain in the River","The Ghost",299
S00496,"Listening To the Street","Melody Crest",334
S00497,"Singing Under the Light","Legend Lyra",252
S00498,"Watching the Gold","Cascade Vega",295
S00499,"Burning Shadow","Drift Echo",221
S00500,"Walking In the Fire","Lady Tide",295
S00501,"Running House","Captain Sirius",253
S00502,"Faded Light","Pulse Frost",475
S00503,"Empty Gate","The Zephyr",343
S00504,"Faded Night","Sir Phoenix",312
S00505,"Singing Firefly","Big Tide",244
S00506,"Faded Voice of Gate","Sister Frost",239
S00507,"Dancing With the Picture","Big Vibe",446
S00508,"Glowing Illusion","Apex Demon",121
S00509,"Living Line in the Whisper","Frost Zephyr",374
S00510,"Remembering the House (Mix 40)","Brother Zenith",356
S00511,"Neon House in the Bridge","Orion Orion",241
S00512,"Sailing On the House","Orion Lyra",413
S00513,"Whispering Illusion in the Phoenix","Cascade Nova",258
S00514,"Haunted Day of Door","Demon Phoenix",146
S00515,"Chasing Night of Night","Echo Phoenix",480
S00516,"Sunrise Page in the Line","Sister Climax",334
S00517,"Summer Heart in the Fire","Solaris Zenith",432
S00518,"Mystic House in the Light","Captain Atlas",248
S00519,"Forgetting the Soul","Spirit Shadow",472
S00520,"Crying Page","Vega Atlas",122
S00521,"Cloudy Song of Wind","Sonic Fable",214
S00522,"Secret Illusion (Mix 12)","Brother Phantom",440
S00523,"Running Gold of Whisper","DJ Drift",138
S00524,"Returning Star","Sister Harmony",332
S00525,"Drifting Sound in the Rose","Lady Solaris",255
S00526,"Mystic Book of Room","The Cascade",356
S00527,"Remembering the Phoenix (Mix 2)","Climax Spirit",283
S00528,"Losing the Whisper","Orion Specter",192
S00529,"Sunrise Mirror of Tree","Vibe Frost",161
S00530,"Singing Under the Ocean","Solaris Vibe",362
S00531,"Returning Rain in the Illusion","Agent Ghost",170
S00532,"Lunar Song of Bridge","Sister Ghost",413
S00533,"Dreamy Water in the Road","Pulse Aero",349
S00534,"Rainy Sky in the Forest","DJ Lyra",305
S00535,"Forgetting the Book (Mix 77)","MC Phantom",187
S00536,"Dying Dust","Lil Blaze",353
S00537,"Neon Sky in the Page","Lady Atlas",477
S00538,"Golden Gold of City","Melody Sirius",301
S00539,"Winter Room in the Garden","Brother Beat",352
S00540,"Running Through the Ocean","The Blaze",413
S00541,"Sunrise Ice in the Glass","Lil Ghost",177
S00542,"Neon Room in the Mirror","Agent Wave",257
