id,title,artist,duration
S02676,"Velvet House","Captain Vega",438
S02677,"Velvet Beat","Crest Orion",311
S02678,"Silent Beat of Path","Big Rhythm",224
S02679,"Dancing With the Garden (Mix 36)","Apex Solaris",461
S02680,"Dancing River","Nova Vibe",422
S02681,"Sailing On the Rain","Drift Fable",389
S02682,"Forgotten Storm of Phoenix","Brother Lyra",251
S02683,"Listening To the River (Mix 12)","Sirius Luna",240
S02684,"Dancing With the Heart (Mix 36)","Brother Phoenix",269
S02685,"Cloudy Page of Town","Captain Myth",467
S02686,"Losing the Town","The Solaris",301
S02687,"Sunrise Glass in the Rain","Agent Atlas",151
S02688,"Chasing the Water","Sir Storm",461
S02689,"Remembered Ice in the Road","Lady Climax",286
S02690,"Running Window","Beat Apex",425
S02691,"Secret Day in the Sound","Agent Phoenix",319
S02692,"Windy Window in the Ice","Zephyr Glide",310
S02693,"Rainy Word of Soul","Captain Myth",149
S02694,"Broken Dust","Solaris Ghost",370
S02695,"Autumn Sound","Pulse Orion",372
S02696,"Haunted Whisper of Dust","Brother Phoenix",436
S02697,"Golden Sky of Rose","The Zenith",264
S02698,"Rainy Moon","Lil Nova",255
S02699,"Broken Page in the Fire","Big Nova",214
S02700,"Singing Under the Echo","Captain Sonic",331
S02701,"Leaving Page in the Tree","Sister Ghost",301
S02702,"Laughing Room in the Picture","Sonic Solaris",126
S02703,"Remembering the River","Climax Spirit",151
S02704,"Hidden Moon of Melody","The Fable",159
S02705,"Crying Illusion in the Word","Phantom Orion",340
S02706,"Searching Glass","Vega Frequency",207
S02707,"Ocean Silence in the Star","Big Beat",363
S02708,"Dying Silver in the Garden","Big Cascade",291
S02709,"Forgetting the Book (Mix 70)","Drift Phoenix",254
S02710,"River Dream of Ice","Frequency Apex",180
S02711,"Dancing Dust in the Glass","Crest Orion",311
S02712,"Cloudy Night in the Forest","Sister Aero",157
S02713,"Forgotten Stone in the Town","Brother Storm",369
S02714,"Forgetting the River (Mix 81)","Cascade Harmony",417
S02715,"Leaving Stone","Spirit Specter",453
S02716,"Hiding From the Rose (Mix 94)","Solaris Harmony",292
S02717,"Running Through the Water (Mix 96)","DJ Wave",343
S02718,"Waiting For the Wave","Specter Zephyr",154
S02719,"Shadowy Town in the Story","The Atlas",451
S02720,"Finding Soul of Voice","Vibe Zenith",366
S02721,"Dying Wave","Lil Nova",316
S02722,"Finding Door in the Ice","Spirit Phantom",190
S02723,"Forgetting the Melody","Climax Beat",479
S02724,"Crimson Gold in the Melody","MC Frequency",419
S02725,"Running Through the Moon (Mix 23)","Sister Beat",248
S02726,"Rising Page of Page","The Zenith",197
S02727,"Dying Light of Glass","MC Orion",433
S02728,"Dancing With the Soul","Luna Beat",137
S02729,"Bitter Firefly of Ocean","Spirit Drift",442
S02730,"Cosmic Stone","Nova Phoenix",449
S02731,"Glowing Ocean in the Street","Lil Climax",410
S02732,"Flying Road of Path","Demon Vibe",129
S02733,"Neon Street in the Song","Brother Rhythm",272
S02734,"Crimson Door in the Rose","Wave Apex",198
S02735,"Electric Ice","Luna Legend",229
S02736,"Empty House of Dream","Captain Drift",204
S02737,"Lunar Light in the Rose","Orion Lyra",267
S02738,"Infinite Ice","Agent Atlas",175
S02739,"Solar Door of Rose","Sir Phoenix",433
S02740,"Dying Room","Sirius Ghost",346
S02741,"Empty Bridge","Phantom Harmony",285
S02742,"Singing Under the Voice","DJ Wave",336
S02743,"Spring Mirror in the Star","The Vega",287
S02744,"Neon Line of Day","Frequency Zenith",292
S02745,"Finding Heart of Forest","The Vega",374
S02746,"Dancing With the Beat (Mix 41)","Spirit Orion",134
S02747,"Dancing Ice of Star","Angel Rhythm",271
S02748,"Remembering the Silence (Mix 39)","Crest Vega",312
S02749,"Infinite Rhythm of Silence","Sir Shadow",403
S02750,"Listening To the Sky (Mix 97)","Rhythm Myth",430
S02751,"Infinite Mirror of Rose","Ghost Ghost",215
S02752,"Running Through the Soul","The Specter",141
S02753,"Hidden Street in the Dust","Climax Zenith",268
S02754,"Finding the Sea (Mix 75)","Sister Echo",297
S02755,"Waiting For the Door","MC Frequency",198
S02756,"Hidden Wind of Moon","Lady Shadow",343
S02757,"Sunrise Door","Lady Tide",461
S02758,"Ocean Mirror","Apex Beat",227
S02759,"Hiding From the Story (Mix 89)","Crest Solaris",472
S02760,"Listening To the Fire","Solaris Zenith",368
S02761,"Bitter Dream","Ghost Zephyr",190
S02762,"Crystal Dust (Mix 55)","Sister Apex",365
S02763,"Broken Path (Mix 74)","Lady Tide",318
S02764,"Crimson Sun in the Sun","Spirit Orion",257
S02765,"Flying Above the Storm","Big Beat",458
S02766,"Secret Gold of Mountain","Sister Harmony",166
S02767,"Fallen Dust in the Rose","The Ghost",432
S02768,"Neon Water","Vibe Luna",265
S02769,"Secret Illusion of Valley","Sir Frost",126
S02770,"Losing the Stone","The Lyra",331
S02771,"Running Through the Sky (Mix 33)","Brother Frequency",192
S02772,"Singing Rhythm of Heart","Lil Melody",308
S02773,"Singing Under the Bridge","Lil Glide",392
S02774,"River Day of Dust","Captain Vega",400
S02775,"Remembering the Story","Brother Angel",225
S02776,"Returning Voice of Wave","The Nova",367
S02777,"Stormy Rain","Sister Echo",178
S02778,"Chasing the Ocean (Mix 32)","DJ Storm",277
S02779,"Dreamy Voice","MC Orion",226
S02780,"Rainy Beat of Soul","The Angel",339
S02781,"Waiting Wind in the Stone","Sir Crest",170
S02782,"Electric Door of House","Phantom Orion",431
S02783,"Dancing Dust of Melody","Lady Tide",280
S02784,"Neon Wind","The Rhythm",433
S02785,"Drifting Window of Forest","Captain Phoenix",259
S02786,"Chasing the Dust (Mix 81)","The Vega",156
S02787,"Broken Day (Mix 90)","Legend Lyra",270
S02788,"Waiting For the Light (Mix 14)","The Aero",188
S02789,"Haunted Beat in the Door","Agent Wave",355
S02790,"Hidden House","Apex Vibe",313
S02791,"Remembering the Sky (Mix 66)","Brother Phoenix",150
S02792,"Dark Mountain of Bridge","Vega Lyra",281
S02793,"Screaming Ocean","The Blaze",217
S02794,"Forgetting the Dream","Phantom Echo",173
S02795,"Dreamy Valley (Mix 98)","Sir Pulse",310
S02796,"Broken Sun (Mix 31)","Sonic Apex",236
S02797,"Hiding From the Fire (Mix 69)","Solaris Harmony",453
S02798,"Crying Silence of Song","Demon Crest",238
S02799,"Singing Whisper in the Light","Sir Shadow",257
S02800,"Neon Gold in the Phoenix","Drift Harmony",263
S02801,"Ocean Moon in the City","Specter Sirius",449
S02802,"Silent Echo of Wave","The Solaris",167
S02803,"Losing the Book (Mix 46)","Tide Frost",369
S02804,"Sweet Gate of Echo","Brother Cascade",225
S02805,"Autumn Word","Cascade Aero",394
S02806,"Starry Town in the Wave","Apex Shadow",323
S02807,"Spring Phoenix (Mix 71)","Sir Pulse",230
S02808,"Dancing Echo of Valley","DJ Blaze",396
S02809,"Sunset Wind","Lil Ghost",155
S02810,"Faded Phoenix","Sir Phoenix",198
S02811,"Crystal Sea","Lil Demon",287
S02812,"Starry Moon","Big Crest",407
S02813,"Living Line of Sky","The Fable",226
S02814,"Chasing the Mirror","Beat Apex",335
S02815,"Screaming Beat in the Dust","Storm Climax",159
S02816,"Waiting Light","Vibe Zenith",157
S02817,"Leaving Window","The Tide",478
S02818,"Stormy Bridge of Mountain","Frost Zephyr",236
S02819,"Ethereal Window in the Glass","Agent Wave",240
S02820,"Crystal Wind in the Glass","Sonic Solaris",256
S02821,"Remembering the Shadow","Lady Aero",232
S02822,"Dark Picture","The Harmony",127
S02823,"Losing the Bridge (Mix 67)","MC Wave",200
S02824,"Electric Mirror in the Voice","The Vibe",355
S02825,"Golden Garden","Agent Wave",239
S02826,"Dreaming Of the Tree (Mix 26)","Sirius Climax",311
S02827,"Searching Soul","Orion Orion",380
S02828,"Waiting For the Road","Big Cascade",285
S02829,"Lost Road in the House","Beat Harmony",415
S02830,"Chasing the Illusion","Brother Rhythm",219
S02831,"Listening To the Silence (Mix 97)","DJ Melody",195
S02832,"Walking In the Soul","Spirit Drift",452
S02833,"Windy Firefly in the Phoenix","Cascade Nova",276
S02834,"Fallen City in the Rain","Captain Zephyr",349
S02835,"Forgetting the Sun","Lyra Luna",139
S02836,"River Beat (Mix 45)","Orion Orion",129
S02837,"Dreaming Of the Street (Mix 48)","Beat Apex",178
S02838,"Chasing Wave of Wave","Lady Sirius",249
S02839,"Midnight Light of Beat","Apex Spirit",476
S02840,"Losing the Firefly (Mix 84)","Sister Demon",360
S02841,"Neon Ice of Sun","Lil Pulse",437
S02842,"Dark Street of Song","The Tide",321
S02843,"Waiting For the Rose (Mix 64)","Sister Ghost",466
S02844,"Neon Mirror of Shadow","Big Rhythm",284
S02845,"Velvet Story in the Word","Myth Demon",269
S02846,"Screaming Window of Sky","Crest Orion",183
S02847,"Summer Path of Forest","Luna Zenith",169
S02848,"Empty Path of Sea","Frequency Apex",402
S02849,"Singing Under the Silence","Zephyr Pulse",443
S02850,"Flying Water in the Story","Apex Wave",249
S02851,"Losing the Page (Mix 16)","Lil Legend",439
S02852,"Serene Window","Big Vibe",265
S02853,"Sailing On the Valley","Phantom Echo",154
S02854,"Dreamy Dust in the Whisper","Legend Lyra",468
S02855,"Velvet Phoenix in the Melody","The Wave",270
S02856,"Winter Illusion in the Storm","Crest Solaris",304
S02857,"Luminous Path of Wave","Lil Pulse",406
S02858,"Wild Forest in the Silence","Captain Apex",312
S02859,"Starry Door","The Harmony",411
S02860,"Sunset Gate in the Star","Lil Frequency",137
S02861,"Stormy Sun","The Zenith",473
S02862,"Dreaming Of the Silence (Mix 6)","Solaris Vibe",225
S02863,"Finding Window of Echo","Blaze Lyra",415
S02864,"River Word in the Voice","DJ Wave",464
S02865,"Whispering Sun","Zephyr Specter",209
S02866,"Solar Picture","Solaris Vibe",417
S02867,"Dying Sky (Mix 89)","DJ Phantom",300
S02868,"Silent Silence","Lil Blaze",162
S02869,"Listening To the Silver","The Drift",155
S02870,"Empty Beat","Vega Vega",184
S02871,"Leaving Light in the Garden","Captain Shadow",362
S02872,"Bitter Stone","Big Zenith",287
S02873,"Cosmic Mountain of Beat","DJ Lyra",209
S02874,"Secret Fire in the Dream","Fable Specter",234
S02875,"Waiting Silence","Storm Specter",238
S02876,"Empty Mirror","Angel Rhythm",178
S02877,"Singing Under the Room (Mix 37)","The Beat",477
S02878,"Luminous Mirror","Sonic Solaris",263
S02879,"Finding the Book (Mix 55)","Atlas Luna",432
S02880,"Haunted Bridge","Lil Blaze",204
S02881,"Shadowy Whisper","Pulse Sirius",417
S02882,"Crying Rain","Lyra Aero",403
S02883,"Losing the Fire (Mix 17)","Sister Melody",354
S02884,"Lost Word in the Street","Legend Vibe",360
S02885,"Fallen Beat of Beat","The Vega",122
S02886,"Sailing On the Mirror","Lil Echo",396
S02887,"Sunset Room in the Wave","Storm Specter",265
S02888,"Windy Wave in the Rose","Phoenix Specter",303
S02889,"Dark Sun","Sir Solaris",327
S02890,"Summer Moon of Door","Vega Lyra",145
S02891,"Dark City of Night","Atlas Rhythm",416
S02892,"Stormy Ocean","Lady Atlas",181
S02893,"Solar Glass","Legend Orion",376
S02894,"Faded Illusion of Word","The Drift",132
S02895,"Rising Tree","Sirius Shadow",394
S02896,"Finding Illusion of Firefly","Agent Phantom",124
S02897,"Cosmic Firefly","Luna Beat",340
S02898,"Dying Song","Echo Beat",367
S02899,"Infinite Fire of Tree","Brother Lyra",379
S02900,"Broken Stone","DJ Blaze",274
S02901,"Haunted Silence of Ice","Lady Demon",379
S02902,"Dancing Stone","Sister Beat",270
S02903,"Electric Line","DJ Melody",187
S02904,"Singing Under the Wind (Mix 98)","Pulse Sirius",373
S02905,"Forgetting the Forest","Myth Specter",446
S02906,"Forgetting the Room (Mix 52)","Drift Cascade",223
S02907,"Finding Mirror of Stone","Glide Drift",424
S02908,"Solar Sound of Valley","Captain Echo",358
S02909,"Whispering Room of Line","DJ Drift",479
S02910,"Velvet Voice in the Stone","Lyra Glide",326
S02911,"Midnight Street of Day","The Blaze",193
S02912,"Remembering the Room","The Sonic",427
S02913,"Dancing Moon","Melody Vibe",186
S02914,"Listening To the Illusion (Mix 99)","Nova Ghost",397
S02915,"Velvet Room in the Rose","MC Orion",389
S02916,"Autumn Song of Song","Phoenix Pulse",430
S02917,"Stormy House of Page","Captain Fable",294
S02918,"Cloudy Gold in the Picture","Agent Phoenix",294
S02919,"Dancing With the Window (Mix 4)","Zephyr Pulse",446
S02920,"Watching the Sea (Mix 54)","The Zephyr",426
S02921,"Stormy Window in the Page","Beat Apex",413
S02922,"Windy Echo","The Nova",146
S02923,"Glowing Light","Crest Orion",372
S02924,"Light Ocean in the Tree","Sister Aero",407
S02925,"Summer Illusion in the Water","Apex Nova",219
S02926,"Dying Ice of Song","Rhythm Myth",292
S02927,"Dancing Rhythm in the Illusion","Big Melody",473
S02928,"Chasing the Road (Mix 42)","The Spirit",324
S02929,"Summer Valley (Mix 96)","Lady Demon",250
S02930,"Faded Fire (Mix 72)","Agent Zenith",446
S02931,"Finding the House","Aero Harmony",273
S02932,"Lunar Gold in the Valley","Lady Tide",468
S02933,"Sunset Mirror in the Mountain","Harmony Apex",219
S02934,"Waiting Garden in the Melody","Orion Specter",473
S02935,"Flying Above the City","Cascade Nova",141
S02936,"Summer Valley of Rhythm","Captain Ghost",192
S02937,"Infinite Road of Mountain","Lil Melody",285
S02938,"Finding Day","DJ Frequency",325
S02939,"Sweet Room","Wave Drift",236
S02940,"Losing the Road","The Vibe",159
S02941,"Burning Sun of Voice","Big Crest",470
S02942,"Midnight Beat in the Sky","Drift Cascade",233
S02943,"Solar Shadow (Mix 37)","Drift Echo",232
S02944,"Crimson Line of Window","The Luna",476
S02945,"Waiting Storm","The Beat",287
S02946,"Dreaming Of the Rose","Agent Storm",348
S02947,"Spring Page of Echo","Brother Frequency",223
S02948,"Secret Echo (Mix 94)","Brother Rhythm",183
S02949,"Walking In the Sun","The Tide",347
S02950,"Whispering Rose","Fable Specter",436
S02951,"Losing the Voice","Lyra Lyra",445
S02952,"Forgetting the Room (Mix 9)","Nova Beat",381
S02953,"Crystal Window in the Page","The Lyra",430
S02954,"Remembering the Flower","Lil Ghost",401
S02955,"Forgotten Book","Lil Frequency",412
S02956,"Broken Gold of Heart","Shadow Legend",257
S02957,"Dying Sky of Rose","Lil Frost",419
S02958,"Remembering the Path","Big Echo",243
S02959,"Serene Song of Echo","The Wave",169
S02960,"Mystic Rose of Ice","The Atlas",181
S02961,"Losing the Light (Mix 45)","Captain Blaze",309
S02962,"Remembered Door","Specter Solaris",310
S02963,"Lunar Beat of Line","Vibe Frost",303
S02964,"Windy Dust of Mirror","The Aero",259
S02965,"Light Ice in the Door","Myth Specter",262
S02966,"Losing the Shadow (Mix 15)","Brother Lyra",406
S02967,"Flying Road in the Fire","The Lyra",236
S02968,"Haunted Door","Big Orion",297
S02969,"Lost Garden","Agent Ghost",421
S02970,"Forgotten River in the Valley","MC Pulse",438
S02971,"Running Day","Captain Zephyr",226
S02972,"Returning Sky in the Rose","Captain Vega",295
S02973,"Electric Line (Mix 8)","Orion Orion",224
S02974,"Waiting For the Garden (Mix 53)","Lyra Luna",330
S02975,"Hiding From the Sun (Mix 59)","The Frost",308
S02976,"Silent Window","Phantom Echo",268
S02977,"Crying Bridge of House","Angel Rhythm",363
S02978,"Crimson Firefly of Bridge","Apex Beat",194
S02979,"Losing the Echo","DJ Sonic",177
S02980,"Dancing With the Stone","Brother Melody",124
S02981,"Screaming Bridge in the Light","Harmony Solaris",207
S02982,"Silent Bridge","Brother Beat",273
S02983,"Whispering Dust","Sir Lyra",339
S02984,"Solar Wind of Silver","Rhythm Sirius",363
S02985,"Waiting For the Book","Zephyr Pulse",324
S02986,"Waiting Heart in the Mirror","Apex Sirius",196
S02987,"Sunset Window in the Soul","Vibe Frost",246
S02988,"Sunrise Mirror in the Picture","Demon Phoenix",210
S02989,"Watching the Firefly","Phantom Harmony",434
S02990,"Running River","Agent Phoenix",284
S02991,"Mystic Road in the River","Agent Sonic",205
S02992,"Flying River in the Street","Demon Sirius",148
S02993,"Running River of Firefly","Apex Wave",237
S02994,"Sweet Mirror of Picture","DJ Demon",193
S02995,"Silver Room in the Soul","Angel Wave",346
S02996,"Sweet Moon of House","Storm Frost",445
S02997,"Forgetting the Flower (Mix 70)","DJ Apex",328
S02998,"Glowing Whisper in the Night","Lady Sirius",260
S02999,"Running Ocean","The Harmony",353
S03000,"Rising Phoenix in the Voice","DJ Ghost",148
S03001,"Running Through the Mountain","Storm Climax",450
S03002,"Dreamy Silence in the Rose","Lil Blaze",194
S03003,"Dark Sound of Mountain","The Cascade",144
S03004,"Bitter Rose of Water","Glide Climax",418
S03005,"Broken Phoenix","Lyra Luna",475
S03006,"Dancing Light in the River","The Cascade",222
S03007,"Starry Rose of Ocean","Sister Frost",479
S03008,"Dying Sound of Stone","Agent Ghost",229
S03009,"Searching Dream in the Story","Sister Frost",397
S03010,"Screaming Bridge","Solaris Phantom",246
S03011,"Serene Town of City","Sister Atlas",314
S03012,"Chasing the Moon (Mix 84)","Solaris Ghost",122
S03013,"Sweet Sound in the Silence","DJ Sonic",274
S03014,"Singing Rose","The Angel",303
S03015,"Neon Mirror in the City","Shadow Angel",378
S03016,"Listening To the Valley","Sirius Luna",204
S03017,"Drifting Dream in the Glass (Mix 58)","Sir Phoenix",306
S03018,"Electric Path","Cascade Harmony",195
S03019,"Windy Rain of Sky","Spirit Specter",185
S03020,"Dreaming Of the Day (Mix 94)","Lady Phantom",158
S03021,"Drifting Story","Specter Sirius",173
S03022,"Bitter Firefly in the Phoenix","Beat Harmony",222
S03023,"Walking In the Fire (Mix 45)","Vega Phantom",232
S03024,"Dreaming Of the Road (Mix 53)","Brother Angel",333
S03025,"Flying Above the Word (Mix 80)","The Sonic",292
S03026,"Fallen Sea of Room","Wave Drift",212
S03027,"Hiding From the Firefly","Spirit Specter",411
S03028,"Cosmic Silence","Vega Frequency",152
S03029,"Waiting For the Rain (Mix 56)","Shadow Angel",351
S03030,"Screaming Sea (Mix 35)","The Specter",259
S03031,"Lunar Water (Mix 82)","Vega Vega",442
S03032,"Rainy Word in the Gate","Apex Nova",425
S03033,"Finding Star in the Window","Sir Wave",184
S03034,"Solar Whisper","Lady Shadow",459
S03035,"River Path of Voice","Sir Aero",330
S03036,"Spring Mirror of Illusion","Vega Frequency",469
S03037,"Finding the Night","Specter Orion",260
S03038,"Remembered Rhythm of Water","DJ Lyra",213
S03039,"Spring Silence in the Illusion","Atlas Rhythm",124
S03040,"Forgetting the Book (Mix 89)","Lyra Glide",425
S03041,"Dancing Rain","Sister Harmony",332
S03042,"Finding the Ice","Demon Zephyr",134
S03043,"Sunrise Sun in the Night","Cascade Nova",477
S03044,"Faded Flower","The Pulse",137
S03045,"Spring Day","Sir Echo",425
S03046,"Running Through the Window","The Frequency",151
S03047,"Faded Sky in the Song","Solaris Phantom",408
S03048,"Living Moon of Line","Big Zenith",142
S03049,"Light Firefly","Lil Legend",364
S03050,"Walking In the Dream","Lady Solaris",261
S03051,"Crying Fire of Light","Sir Spirit",422
S03052,"Returning Road of Rhythm","Legend Lyra",131
S03053,"Dreamy Sea","Brother Phoenix",262
S03054,"Burning Word","Lil Ghost",270
S03055,"Spring Page of Wind","Storm Frost",212
S03056,"Winter City of Mountain","Shadow Legend",369
S03057,"Whispering Forest in the Forest","Fable Specter",350
S03058,"Haunted Sea in the Sea","Melody Crest",327
S03059,"Sunset City","Big Sirius",446
S03060,"Solar Rain","Pulse Orion",375
S03061,"Losing the Ice","Nova Ghost",208
S03062,"Dancing Glass of Ice","Big Aero",364
S03063,"Ocean Forest in the Story","Lil Echo",436
S03064,"Forgetting the Line (Mix 5)","Agent Ghost",248
S03065,"Running Through the Sound","Lil Echo",390
S03066,"Singing Under the Star","Agent Vega",384
S03067,"Winter Light","Frost Apex",476
S03068,"Ocean Whisper in the Line","Vibe Phantom",152
S03069,"Drifting Street of Rhythm","Captain Frost",346
S03070,"Dancing Rhythm in the Flower","Lyra Lyra",379
S03071,"Empty Song of Shadow","Vega Sonic",382
S03072,"Fallen Glass","Agent Orion",478
S03073,"Dancing With the Tree (Mix 93)","Orion Lyra",174
S03074,"Starry Town of Bridge","The Solaris",455
S03075,"Electric River in the Whisper","Brother Zenith",364
S03076,"Shadowy Rose","Beat Apex",400
S03077,"Hiding From the Word (Mix 87)","Spirit Phantom",265
S03078,"Hiding From the Wave","Agent Pulse",299
S03079,"Finding the City","Blaze Lyra",428
S03080,"Cosmic Room of Day","Specter Orion",169
S03081,"Dancing With the Stone (Mix 50)","Ghost Specter",388
S03082,"Ocean Tree in the Sea","Luna Lyra",283
S03083,"Singing Heart in the Soul","Cascade Vibe",277
S03084,"Losing the Shadow (Mix 86)","Big Myth",307
S03085,"Living Line of Beat","Spirit Orion",399
S03086,"Waiting For the Window (Mix 17)","Lil Wave",133
S03087,"Haunted Shadow","Climax Beat",203
S03088,"Sunset River","Orion Specter",395
S03089,"Dreaming Of the Water","Agent Pulse",464
S03090,"Lost Wind in the Phoenix","Glide Apex",250
S03091,"Burning Phoenix","Tide Frost",360
S03092,"Velvet City of Forest","DJ Phantom",462
S03093,"Luminous Flower in the Wave","Sister Atlas",423
S03094,"Finding Shadow of Sun","Captain Fable",245
S03095,"River Wind in the Silver","Big Melody",456
S03096,"Sunrise Garden","Sir Sonic",406
S03097,"Golden Beat in the Beat","Zephyr Pulse",199
S03098,"Ethereal Rain","Captain Shadow",445
S03099,"Light Sound of Light","Frost Apex",422
S03100,"Electric Dust in the Wave","Drift Harmony",321
S03101,"Fallen Light","Solaris Lyra",358
S03102,"Hidden River in the Road","Captain Ghost",443
S03103,"Flying Above the Ocean","MC Pulse",399
S03104,"Velvet Line in the Bridge","Sir Shadow",151
S03105,"Dancing With the River (Mix 57)","MC Legend",136
S03106,"Spring Flower of Ocean","Angel Crest",299
S03107,"Remembered River in the Mountain","Atlas Sonic",410
S03108,"Whispering Sky in the Voice","Solaris Vibe",187
S03109,"Lunar Glass of Bridge","Agent Orion",444
S03110,"Forgetting the Light (Mix 91)","Sister Apex",397
S03111,"Ethereal Path of Bridge","Climax Apex",235
S03112,"Singing Under the Shadow","Lil Melody",336
S03113,"Sunset Fire in the Forest","The Atlas",128
S03114,"Infinite House in the Ocean","Vibe Zenith",455
S03115,"Fallen Day of Sound","Lil Lyra",190
S03116,"Hiding From the Rain","Aero Harmony",342
S03117,"Electric Page","Cascade Vibe",139
S03118,"Glowing Mirror in the Road","DJ Echo",349
S03119,"Crystal Valley in the Road","Echo Phoenix",158
S03120,"Spring Silence of Gold","MC Legend",178
S03121,"Searching Wind of Forest","Drift Cascade",225
S03122,"Returning Wave in the Echo","The Phantom",384
S03123,"Listening To the Window","Lady Phantom",396
S03124,"Lost House","Lil Demon",473
S03125,"Rising Wave","Phoenix Crest",395
S03126,"Whispering Wave of House","Echo Phoenix",139
S03127,"Rising Rose in the Stone","Lady Demon",169
S03128,"Crying Heart (Mix 52)","MC Apex",326
S03129,"Crying Rhythm of Picture","Legend Orion",444
S03130,"Starry Light of Night","The Vibe",125
S03131,"Finding Sea in the Path","Melody Crest",263
S03132,"Stormy Night of Song","Agent Wave",471
S03133,"Laughing Phoenix","DJ Storm",417
S03134,"Laughing Door","Sister Demon",217
S03135,"Bitter Page in the Ice","Specter Drift",308
S03136,"Electric Rain","Rhythm Beat",320
S03137,"Windy Mountain of Town","Demon Phoenix",171
S03138,"Waiting River of Shadow","Sir Frost",340
S03139,"Watching the Word","Sirius Shadow",344
S03140,"Walking In the Garden","Agent Storm",422
S03141,"Drifting Door","Sir Crest",419
S03142,"Windy Room of Rhythm","Phantom Harmony",290
S03143,"Sunset Town of Rose","Captain Fable",475
S03144,"Ocean Picture in the River","Lil Storm",433
S03145,"Electric Rain in the Flower","Phantom Orion",427
S03146,"Velvet Road of Voice","Wave Storm",291
S03147,"Chasing the Room","Sirius Specter",224
S03148,"Dreaming Of the City (Mix 96)","Lil Demon",283
S03149,"Flying Night","Spirit Phantom",207
S03150,"Wild Bridge of City","Cascade Wave",297
S03151,"Glowing Tree","Lil Legend",226
S03152,"Finding Page","Lil Legend",239
S03153,"Drifting Mountain of Phoenix","Big Ghost",307
S03154,"Returning Night","Captain Rhythm",470
S03155,"Running Through the Wave","Cascade Vibe",149
S03156,"Mystic Gate","Lil Sonic",308
S03157,"Ocean Melody","Sirius Sonic",139
S03158,"Stormy Silver (Mix 65)","Brother Storm",369
S03159,"Flying Glass","Sir Sonic",445
S03160,"Listening To the Ocean","DJ Wave",216
S03161,"Singing Under the Voice (Mix 10)","Luna Legend",149
S03162,"Remembering the Gold (Mix 22)","Specter Drift",180
S03163,"Cloudy Silence in the Storm","Captain Phantom",290
S03164,"Waiting Day of Melody","Luna Beat",347
S03165,"Hidden Window in the City","Atlas Sonic",360
S03166,"Running Melody of Silence","Luna Zenith",132
S03167,"Mystic Town (Mix 31)","The Fable",152
S03168,"Hiding From the Night","Nova Beat",269
S03169,"Light Beat","The Blaze",285
S03170,"Infinite Window of Room","DJ Drift",277
S03171,"Crying Sound","Agent Sirius",126
S03172,"Ocean Book of Room","Sir Fable",131
S03173,"Finding Gate of Ocean","Agent Phantom",261
S03174,"Sailing On the City","Tide Shadow",357
S03175,"Crying Sun of Bridge","Angel Luna",469
S03176,"Flying Rose","DJ Blaze",192
S03177,"Sailing On the Flower (Mix 86)","The Angel",406
S03178,"Waiting For the Voice","Myth Specter",330
S03179,"Leaving Wind of City","DJ Demon",255
S03180,"Waiting For the Flower (Mix 18)","Brother Apex",415
S03181,"Crying Mirror in the Night","Climax Apex",250
S03182,"Running Through the Silver","Drift Fable",178
S03183,"Watching the Soul","Lady Aero",228
S03184,"Rainy Whisper in the Illusion","Lyra Luna",425
S03185,"Chasing the Voice (Mix 16)","DJ Phantom",412
S03186,"Running Through the Word","The Echo",210
S03187,"Autumn Room of Firefly","Phoenix Solaris",249
S03188,"Whispering Dream","Demon Zephyr",178
S03189,"Dreaming Of the Melody (Mix 86)","Lady Glide",404
S03190,"Waiting Gold in the Moon","MC Pulse",310
S03191,"Sweet Picture","Legend Lyra",435
S03192,"Dying Forest","Vega Vega",263
S03193,"Hiding From the Phoenix (Mix 74)","Captain Wave",288
S03194,"Watching the Story (Mix 1)","Apex Beat",348
S03195,"Winter Firefly of House","Legend Vibe",439
S03196,"Starry Night of Shadow","Shadow Atlas",449
S03197,"Sweet Tree of Town","Captain Blaze",151
S03198,"Midnight Firefly in the Song","Agent Sonic",344
S03199,"Hidden Bridge","Demon Echo",331
S03200,"Hidden Room in the Path","Agent Phantom",147
S03201,"Bitter Mountain in the Street","Legend Orion",271
S03202,"Sailing On the Valley (Mix 15)","Sirius Climax",471
S03203,"Stormy Forest in the Song","Sir Aero",349
S03204,"Summer Town in the Dust","The Harmony",179
S03205,"Silent Dust","Solaris Harmony",141
S03206,"Spring Wind in the Garden","Nova Ghost",421
