id,title,artist,duration
S07355,"Ocean Rhythm in the Beat","Orion Specter",456
S07356,"Burning Street in the Silver","The Beat",314
S07357,"Burning Line in the Night","DJ Melody",469
S07358,"Leaving Dust of Light","Lil Legend",454
S07359,"Drifting Sun","Lady Demon",355
S07360,"Ethereal Song of Voice","Lil Blaze",359
S07361,"Silver Rain in the Door","The Phoenix",248
S07362,"Whispering Fire in the Silence","Big Melody",198
S07363,"Dying Street in the Wave","Drift Fable",438
S07364,"Serene Illusion of Firefly","The Orion",351
S07365,"Stormy Gold","Sirius Specter",382
S07366,"Sweet Picture (Mix 34)","Big Tide",416
S07367,"Screaming Sea of Gate","MC Orion",198
S07368,"Serene Moon (Mix 43)","Lil Rhythm",137
S07369,"Fallen Door (Mix 38)","Luna Beat",433
S07370,"Waiting For the Rose (Mix 72)","Agent Phantom",469
S07371,"Dreamy Rain in the Water","Agent Wave",145
S07372,"Dreaming Of the Fire (Mix 92)","DJ Blaze",471
S07373,"Rising Forest in the Page","The Lyra",327
S07374,"Windy Path of Street","Sir Crest",369
S07375,"Chasing the Rhythm (Mix 41)","Rhythm Cascade",148
S07376,"Summer Storm of Window","Ghost Pulse",328
S07377,"Running Through the Storm (Mix 88)","DJ Frequency",381
S07378,"Dark Rose (Mix 4)","Spirit Phantom",274
S07379,"Flying Light","MC Apex",314
S07380,"Returning Gold of Story","The Nova",268
S07381,"Cosmic Rhythm (Mix 49)","Drift Harmony",263
S07382,"Serene Light","Crest Solaris",226
S07383,"Crystal Sound of Shadow","Agent Ghost",374
S07384,"Crystal Song (Mix 24)","Sir Storm",211
S07385,"Wild Whisper of Day","Lady Phantom",217
S07386,"Sunrise Forest","Lil Pulse",462
S07387,"Spring House (Mix 21)","Specter Zephyr",388
S07388,"Luminous Dust of Moon","Melody Luna",269
S07389,"Cosmic Story","Lady Atlas",163
S07390,"Golden Silence (Mix 39)","The Storm",306
S07391,"Faded Night (Mix 88)","Frequency Cascade",480
S07392,"Summer Sea of Door","MC Frost",194
S07393,"Walking In the Sea (Mix 68)","Brother Beat",190
S07394,"Ethereal Mountain of Ice","Solaris Vibe",278
S07395,"Faded Street of Line","Nova Beat",334
S07396,"Secret Storm in the Water","Lady Sirius",292
S07397,"River Light in the River","Glide Drift",323
S07398,"Forgotten Room in the Road","Sister Apex",160
S07399,"Chasing the Firefly (Mix 99)","Sister Phoenix",279
S07400,"Drifting Sound","The Orion",433
S07401,"Chasing Light of Street","The Fable",212
S07402,"Solar Page of Illusion","Captain Wave",307
S07403,"Waiting For the Sea (Mix 17)","MC Harmony",302
S07404,"Dancing With the Song (Mix 77)","Sister Apex",317
S07405,"Laughing Voice","The Specter",447
S07406,"Sunset Wave (Mix 41)","Brother Spirit",200
S07407,"Solar Rose of Silver","Drift Echo",283
S07408,"Hidden Ice of Wave","Ghost Pulse",406
S07409,"Waiting For the Heart (Mix 46)","Sister Beat",165
S07410,"Crimson Fire (Mix 24)","Agent Orion",479
S07411,"Velvet Valley (Mix 47)","Storm Drift",363
S07412,"Remembering the Shadow (Mix 20)","Agent Atlas",275
S07413,"Dying Silence in the Ice","Specter Solaris",252
S07414,"Starry Gold in the Street","Sonic Apex",372
S07415,"Dreamy Melody of Story","Vega Sonic",444
S07416,"Hidden Whisper of Page","Frequency Atlas",398
S07417,"Winter Word of Ice","Captain Vega",336
S07418,"Windy Picture","Agent Storm",264
S07419,"Faded Glass of Silver","Myth Demon",480
S07420,"Listening To the Line (Mix 72)","Agent Atlas",313
S07421,"Ocean Shadow of Sea","Brother Specter",163
S07422,"Sunrise Moon of Room","Frequency Apex",223
S07423,"Flying Above the Bridge (Mix 74)","Phoenix Pulse",124
S07424,"Spring Light in the Town","Beat Phantom",373
S07425,"Light Sea of Echo","Brother Phantom",234
S07426,"Sailing On the City (Mix 8)","Phoenix Pulse",479
S07427,"River Storm in the Ice","Beat Phantom",266
S07428,"Running Through the Ocean (Mix 32)","Drift Fable",239
S07429,"Faded Rain in the Dust","Luna Zenith",201
S07430,"Sweet Road of Glass","The Tide",174
S07431,"Summer Beat (Mix 65)","Legend Lyra",431
S07432,"Faded Dream in the Mountain","Lil Frequency",202
S07433,"Singing Under the Mirror (Mix 82)","Lil Blaze",417
S07434,"Solar Moon of Rhythm","Brother Apex",401
S07435,"Empty Tree of Sky","Sir Sonic",272
S07436,"Sweet Sun of Sea","Sirius Specter",190
S07437,"Finding the Soul (Mix 46)","Lil Sonic",178
S07438,"Chasing the Valley (Mix 59)","Rhythm Glide",234
S07439,"Silent Flower in the Beat","DJ Frequency",356
S07440,"Broken Street (Mix 15)","Harmony Solaris",165
S07441,"Waiting Ocean of Phoenix","Luna Lyra",291
S07442,"Rainy Path in the Firefly","Phoenix Pulse",240
S07443,"Empty Valley in the Silver","DJ Legend",137
S07444,"Forgotten Night in the Storm","Big Echo",323
S07445,"Walking In the Beat (Mix 19)","Crest Crest",467
S07446,"Walking In the Word","Sister Luna",392
S07447,"Crying Mirror of Soul","Storm Climax",177
S07448,"Sunset Sky in the Storm","Lady Blaze",476
S07449,"Solar Book in the Line","Sister Harmony",367
S07450,"Dreamy Sound of Sun","Captain Myth",255
S07451,"Neon Dust","DJ Blaze",377
S07452,"Silent Rose","The Vibe",309
S07453,"Finding the Storm (Mix 82)","Apex Shadow",247
S07454,"Running Through the Road (Mix 50)","Orion Specter",349
S07455,"Dreamy Forest (Mix 42)","Sister Phoenix",436
S07456,"Laughing Song in the Wave","Tide Apex",395
S07457,"Hiding From the Stone (Mix 78)","Cascade Echo",411
S07458,"Forgetting the Night (Mix 37)","Wave Drift",129
S07459,"Golden Forest in the Bridge","Captain Blaze",453
S07460,"Luminous Phoenix in the River","Frost Orion",250
S07461,"Electric Picture of Picture","DJ Sonic",331
S07462,"Summer Fire in the Rain","Blaze Apex",480
S07463,"Ocean Heart of Water","Sister Frost",255
S07464,"Crying Ice of Mirror","Lady Wave",159
S07465,"Winter Silence of Valley","Spirit Orion",374
S07466,"Electric Silver in the Path","Climax Beat",226
S07467,"Chasing the Door","DJ Wave",329
S07468,"Bitter Line (Mix 64)","Melody Demon",387
S07469,"Walking In the Tree (Mix 86)","Lil Nova",364
S07470,"Secret Tree","Sonic Solaris",392
S07471,"Waiting Sea of Beat","Brother Melody",471
S07472,"Lost Dust in the Mirror","Brother Cascade",243
S07473,"Dreaming Of the Rhythm (Mix 91)","Ghost Pulse",200
S07474,"Leaving Dust of Path","Captain Blaze",257
S07475,"Dancing With the Tree (Mix 42)","Sonic Vibe",242
S07476,"Silver Garden in the Tree","DJ Phantom",148
S07477,"Autumn Night of Echo","DJ Legend",390
S07478,"Dreaming Of the Melody (Mix 99)","Cascade Nova",271
S07479,"Cosmic City in the Night","Lil Lyra",330
S07480,"Losing the Dream (Mix 83)","Lil Sonic",320
S07481,"Leaving Wind","Orion Orion",162
S07482,"Flying Above the Town (Mix 27)","Sir Frost",437
S07483,"Running Through the Page","Apex Nova",286
S07484,"Watching the Soul (Mix 89)","The Melody",333
S07485,"Sweet Town of Echo","Lil Rhythm",285
S07486,"Remembered Story of Rose","Sister Beat",426
S07487,"Lost River of Ocean","Lil Harmony",338
S07488,"Sunrise Voice in the Sea","Sister Phoenix",215
S07489,"Living Road (Mix 95)","Captain Sonic",405
S07490,"Cloudy Book","Lil Blaze",244
S07491,"Cosmic Path of Tree","Melody Vibe",193
S07492,"Losing the Street (Mix 69)","Lil Vega",457
S07493,"Dreamy Sun in the Ice","Sister Ghost",127
S07494,"Watching the Rose (Mix 54)","The Aero",369
S07495,"Silent River of Storm","Sir Shadow",186
S07496,"Infinite Wave in the Rhythm","Storm Glide",197
S07497,"Leaving Beat in the Street","Lady Glide",200
S07498,"Spring Rhythm in the Heart","Vibe Vibe",161
S07499,"Dying Song in the Book","Agent Zenith",328
S07500,"Remembering the Mirror (Mix 94)","Big Nova",360
S07501,"Electric Rhythm in the Wind","Harmony Frequency",451
S07502,"Lunar Melody of Echo","Apex Vibe",226
S07503,"Running Through the Word (Mix 97)","DJ Melody",467
S07504,"Stormy Rain (Mix 47)","The Sonic",298
S07505,"Dancing Storm","MC Orion",163
S07506,"Light Moon","Agent Orion",365
S07507,"Returning Day of Forest","The Apex",222
S07508,"Chasing the Day (Mix 44)","Glide Apex",321
S07509,"Electric Gate of Valley","Tide Apex",120
S07510,"Singing Under the Wind (Mix 33)","The Harmony",244
S07511,"Faded Garden in the Room","Brother Melody",225
S07512,"Wild Book of Book","Phantom Echo",229
S07513,"Flying Forest in the Room","Blaze Apex",263
S07514,"Dying Path in the Dust","Spirit Tide",145
S07515,"Broken Gate of Night","Storm Wave",476
S07516,"Stormy Beat of Storm","Sir Glide",158
S07517,"Sunrise City","The Phoenix",166
S07518,"Returning Echo in the Dream","Apex Cascade",257
S07519,"Burning Storm in the Sun","Angel Crest",464
S07520,"Spring Sound","Cascade Angel",162
S07521,"Hiding From the Firefly (Mix 43)","Beat Phantom",350
S07522,"Luminous Firefly in the Whisper","Climax Ghost",438
S07523,"Hiding From the Voice","Storm Drift",303
S07524,"Running Storm in the Dream","Sir Spirit",247
S07525,"Neon Room","Captain Phantom",368
S07526,"Hidden Page in the Bridge","The Sirius",310
S07527,"Burning Wave in the Day","Aero Harmony",293
S07528,"Dreamy Ocean of Picture","Sonic Vibe",280
S07529,"Cloudy Door (Mix 63)","Big Aero",304
S07530,"Drifting Night of House","Lil Frequency",179
S07531,"Glowing Water","Brother Lyra",207
S07532,"Whispering Ocean (Mix 70)","Agent Pulse",394
S07533,"Luminous Valley in the Illusion","Phantom Orion",233
S07534,"Dark Dream","Agent Pulse",453
S07535,"Hiding From the Room (Mix 39)","Frost Orion",357
S07536,"Running Dust of Town","Brother Beat",253
S07537,"Dancing Sky of Rain","Crest Crest",455
S07538,"Remembered Valley of Melody","Vibe Zenith",390
S07539,"Silent Soul of House","The Melody",159
S07540,"Dreaming Of the Shadow (Mix 15)","Harmony Frequency",346
S07541,"Finding Rain of Wind","Captain Vega",480
S07542,"Starry Day of Melody","Big Vibe",220
S07543,"Dying Picture of Illusion","Phantom Phoenix",428
S07544,"Losing the Silence","Sister Aero",434
S07545,"Returning Gate","Legend Orion",447
S07546,"Haunted Gold of Soul","Sister Atlas",271
S07547,"Sunrise Voice of Light","Vega Lyra",420
S07548,"Drifting City in the Night","DJ Sirius",242
S07549,"Chasing Forest of Ocean","Atlas Luna",267
S07550,"Running Through the Mountain (Mix 91)","Wave Apex",299
S07551,"Dancing Silence in the Glass","Brother Spirit",170
S07552,"Hiding From the Ocean","The Demon",232
S07553,"Dancing With the Sky (Mix 92)","MC Orion",315
S07554,"Finding Fire of Tree","Solaris Vibe",210
S07555,"Dreaming Of the Forest (Mix 60)","Sonic Solaris",135
S07556,"Silent Phoenix of Road","Lil Wave",432
S07557,"Singing Stone (Mix 61)","Sister Demon",217
S07558,"Luminous Echo","Sirius Sonic",303
S07559,"Waiting Gold in the Silence","Angel Crest",248
S07560,"Drifting Echo of Melody","Demon Vibe",247
S07561,"Chasing Mirror in the Beat","The Sirius",133
S07562,"Singing Valley in the Voice","Blaze Lyra",127
S07563,"Electric Picture","Sister Phoenix",303
S07564,"Running Through the Fire (Mix 4)","The Crest",284
S07565,"Sailing On the Picture","Lil Frequency",367
S07566,"Walking In the Book (Mix 67)","Captain Aero",458
S07567,"Dying Night in the Road","Lil Melody",408
S07568,"Laughing Road of Story","Specter Solaris",172
S07569,"Spring Whisper in the Window","The Solaris",257
S07570,"Walking In the Water","The Echo",209
S07571,"Solar Heart of Window","Big Aero",391
S07572,"Windy Flower of Bridge","Frequency Cascade",463
S07573,"Listening To the Page","Cascade Vibe",358
S07574,"Chasing the Light","Vega Sonic",459
S07575,"Waiting For the Ice (Mix 20)","Spirit Glide",330
S07576,"Dancing Tree","Rhythm Myth",133
S07577,"Listening To the Star (Mix 24)","Brother Phantom",261
S07578,"Crystal Ice","Brother Melody",156
S07579,"Winter Valley (Mix 15)","Orion Orion",339
S07580,"Mystic Path (Mix 16)","The Angel",194
S07581,"Listening To the Soul (Mix 38)","Big Spirit",432
S07582,"Losing the Room","Pulse Sirius",213
S07583,"Burning Flower","Lil Sirius",356
S07584,"Walking In the City (Mix 21)","Aero Apex",235
S07585,"Screaming Line in the Sun","Specter Solaris",466
S07586,"Drifting Silver","Sirius Climax",120
S07587,"Infinite Mirror of Room","Vega Lyra",163
S07588,"Rainy Tree in the Fire","MC Apex",325
S07589,"Losing the Flower","Sir Fable",415
S07590,"Whispering Valley","DJ Lyra",378
S07591,"Lunar Picture in the Sun","The Rhythm",276
S07592,"Solar Wind in the City","Agent Pulse",438
S07593,"Glowing Star","Sonic Solaris",300
S07594,"Sunrise Wave of Sun","Melody Phoenix",245
S07595,"Losing the Soul","Vega Phantom",140
S07596,"Faded Storm of Night","MC Pulse",450
S07597,"Lost Star in the City","Brother Phantom",132
S07598,"Leaving Mountain of Song","MC Legend",392
S07599,"Watching the Star (Mix 94)","Rhythm Lyra",132
S07600,"Cloudy Water of Star","Apex Wave",345
S07601,"Listening To the Tree","Lady Wave",235
S07602,"Stormy Wind in the Storm","Cascade Vibe",314
S07603,"Hiding From the Phoenix (Mix 35)","Frost Zephyr",315
S07604,"Chasing the Sea (Mix 15)","Agent Phantom",279
S07605,"Velvet Wind","Solaris Phantom",243
S07606,"Winter Soul in the Echo","DJ Drift",142
S07607,"Crystal Glass in the Song","DJ Melody",344
S07608,"Hiding From the Road (Mix 50)","Big Echo",463
S07609,"Remembered Tree of Gate","DJ Lyra",396
S07610,"Glowing Gate in the Picture","The Angel",432
S07611,"Hidden Heart in the Illusion","Lady Blaze",178
S07612,"Sweet Gold","Specter Sirius",291
S07613,"Living City of Rose","The Fable",374
S07614,"Chasing Tree in the Line","Spirit Blaze",139
S07615,"Waiting Forest (Mix 52)","The Wave",339
S07616,"Luminous Soul in the Wind","Vega Lyra",223
S07617,"Running Through the Wind (Mix 71)","Captain Frost",450
S07618,"Drifting House","Demon Crest",443
S07619,"Golden Sky in the Sound","Sir Climax",368
S07620,"Crying Mirror","Sonic Apex",285
S07621,"Golden Gate in the Voice","Lady Phantom",148
S07622,"Fallen Song","Brother Cascade",368
S07623,"Walking In the Flower (Mix 40)","The Harmony",300
S07624,"Flying Above the Town (Mix 59)","Sonic Apex",302
S07625,"Midnight Story in the Mirror","Ghost Specter",167
S07626,"Living Echo (Mix 43)","Sir Aero",428
S07627,"Sailing On the Wave (Mix 34)","Lil Pulse",327
S07628,"Neon Book in the Tree","The Cascade",442
S07629,"Laughing Street in the Moon","The Phantom",331
S07630,"Empty Rose","Zephyr Specter",137
S07631,"Secret Phoenix of Shadow","Drift Cascade",280
S07632,"Leaving Gold in the Forest","Melody Ghost",323
S07633,"Serene Gate of Ocean","Agent Orion",125
S07634,"Living Window in the Silence","Big Crest",236
S07635,"Watching the Gold (Mix 41)","Sir Glide",244
S07636,"Listening To the Heart (Mix 77)","Sister Harmony",197
S07637,"Dancing Dust in the Star","Lil Blaze",387
S07638,"Lost Garden of Book","The Crest",357
S07639,"Losing the Door (Mix 13)","Apex Demon",372
S07640,"Silent Bridge of Ice","Pulse Orion",132
S07641,"Searching Star of River","Luna Lyra",282
S07642,"Waiting For the Door (Mix 22)","Sir Vibe",371
S07643,"Listening To the Tree (Mix 7)","Apex Sirius",370
S07644,"Forgotten Song in the Story","The Harmony",330
S07645,"Autumn Door in the Rhythm","Lil Demon",215
S07646,"Finding the Window (Mix 4)","Sir Climax",390
S07647,"Silver Beat of Fire","Atlas Sonic",206
S07648,"Singing Glass of Flower","Nova Vibe",340
S07649,"Wild Star in the Picture","DJ Phantom",366
S07650,"Living Door of Firefly","Melody Demon",419
S07651,"Faded Wind (Mix 12)","Demon Apex",142
S07652,"Rainy Moon of Voice","Vibe Zenith",269
S07653,"Finding the Dream","Demon Echo",217
S07654,"Screaming Town of Road","Specter Sirius",455
S07655,"Wild Day in the Sky","Demon Echo",329
S07656,"Sailing On the Star","Storm Specter",247
S07657,"River Water of Dream","Cascade Wave",311
S07658,"Starry Line of River","Melody Ghost",347
S07659,"Windy Town in the Fire","Legend Vibe",409
S07660,"Screaming Phoenix of Glass","Echo Beat",329
S07661,"Crying Street","Agent Vega",300
S07662,"Chasing Beat in the House","Lil Frequency",479
S07663,"Infinite Silver (Mix 53)","Wave Apex",215
S07664,"Glowing Garden","Storm Glide",266
S07665,"Silver Flower of Glass","Sonic Solaris",234
S07666,"Finding Sky","Luna Beat",479
S07667,"Haunted Rose in the Sea","Phantom Orion",139
S07668,"Broken Phoenix in the Ocean","Vega Vega",208
S07669,"Mystic Sun (Mix 12)","Sir Frequency",149
S07670,"Rising Gate of Picture","The Glide",179
S07671,"Dying Story (Mix 65)","Lady Solaris",231
S07672,"Velvet Street of Line","Lil Legend",477
S07673,"Remembered Silence","Captain Aero",405
S07674,"Wild Phoenix of Storm","Aero Harmony",297
S07675,"Sailing On the Sun","Brother Phantom",405
S07676,"Summer Dream in the Forest","Cascade Vibe",126
S07677,"Finding Garden","Lyra Aero",158
S07678,"Dying Ice in the Rain","Shadow Legend",235
S07679,"Silver Wind of Path","Agent Sirius",272
S07680,"Chasing the Picture (Mix 55)","Lil Lyra",306
S07681,"Empty Moon","Angel Luna",303
S07682,"Chasing the Sky (Mix 31)","The Sonic",318
S07683,"Singing Under the Beat (Mix 22)","MC Frequency",360
S07684,"Dancing With the Page (Mix 33)","Legend Vibe",236
S07685,"Forgotten Light of Sea","The Spirit",140
S07686,"Spring Firefly in the Garden","Sir Echo",268
S07687,"Remembering the City (Mix 38)","Big Zenith",325
S07688,"Drifting Mirror of Shadow","Captain Frost",131
S07689,"Crystal Wind","Melody Demon",167
S07690,"Dancing With the Forest (Mix 65)","Specter Apex",446
S07691,"Walking In the Sky (Mix 51)","Sister Drift",409
S07692,"Golden Fire in the Line","Demon Zephyr",315
S07693,"Burning Heart","Specter Apex",135
S07694,"Broken Book in the Water","The Sonic",165
S07695,"Singing Under the Tree (Mix 64)","Beat Apex",228
S07696,"Chasing River of Story","Vega Phantom",146
S07697,"Sweet Sea of Room","Luna Beat",440
S07698,"Dark Illusion in the Whisper","DJ Apex",324
S07699,"Bitter Day in the Ocean","Angel Luna",238
S07700,"Remembering the Star (Mix 48)","Lil Echo",134
S07701,"Haunted Beat","The Demon",459
S07702,"Burning Water of Voice","Atlas Luna",326
S07703,"Stormy Sound in the Song","The Sirius",176
S07704,"Sweet Dust in the Flower","Storm Climax",243
S07705,"Empty Mirror (Mix 78)","Solaris Lyra",227
S07706,"Glowing Town (Mix 93)","Spirit Orion",286
S07707,"Flying Above the Rose (Mix 98)","Agent Phoenix",370
S07708,"Crystal Tree in the Sun","The Spirit",302
S07709,"Losing the Glass (Mix 75)","Captain Atlas",281
S07710,"Cosmic Light (Mix 98)","Captain Zephyr",130
S07711,"Crystal Gold of Forest","The Pulse",383
S07712,"Haunted Flower in the River","Lady Glide",474
S07713,"Screaming Sound of Story","Sir Storm",125
S07714,"Broken Sun of Rose","Sir Glide",435
S07715,"Fallen Picture of Star","Luna Zenith",290
S07716,"Waiting Dream","The Blaze",353
S07717,"Luminous Shadow (Mix 27)","Storm Atlas",362
S07718,"Running Through the Day (Mix 44)","Specter Sirius",141
S07719,"Empty Whisper in the Phoenix","Specter Apex",473
S07720,"Shadowy Forest in the Picture","Spirit Phantom",442
S07721,"Silent Road of Dust","Brother Frequency",472
S07722,"Waiting City","Vibe Phantom",245
S07723,"Remembered Gold in the Line","Storm Wave",133
S07724,"Sunrise Day","Cascade Vega",417
S07725,"Sunrise Glass (Mix 5)","Sister Aero",206
S07726,"Lost Night of Ocean","Lady Sirius",312
S07727,"Golden Sun in the Silence","Harmony Apex",280
S07728,"Silver Picture in the Moon","Agent Pulse",388
S07729,"Losing the Tree (Mix 1)","Captain Blaze",230
S07730,"Dreaming Of the Phoenix (Mix 65)","Solaris Vibe",161
S07731,"Flying Above the Window (Mix 26)","Orion Orion",480
S07732,"Crystal Shadow","Angel Luna",241
S07733,"Crying Forest","Storm Frost",299
S07734,"Losing the Path","Angel Storm",395
S07735,"Fallen Light (Mix 37)","Lady Tide",326
S07736,"Forgetting the Picture (Mix 55)","Lady Vega",361
S07737,"Neon Night of Line","Sir Spirit",389
S07738,"Running Silence","MC Pulse",258
S07739,"Broken Glass","MC Legend",139
S07740,"Wild Voice in the Moon","Drift Fable",248
S07741,"Searching Voice","Phoenix Specter",168
S07742,"Broken Dust (Mix 78)","Fable Specter",315
S07743,"Losing the Valley","DJ Zephyr",290
S07744,"Laughing Path in the Path","Lil Frost",437
S07745,"Electric Shadow (Mix 73)","Agent Phantom",214
S07746,"Forgotten Room in the Ice","The Solaris",453
S07747,"Bitter Ocean of Rose","Phoenix Crest",258
S07748,"Velvet Mountain","Sonic Solaris",480
S07749,"Broken Rhythm in the Sky","Frost Zephyr",185
S07750,"Rainy Forest in the Night","Sir Sonic",311
S07751,"Sailing On the Silence (Mix 80)","Drift Harmony",406
S07752,"Finding Dream in the Gold","Specter Zephyr",447
S07753,"Empty Forest of Rose","Captain Zephyr",317
S07754,"Screaming Wind of Voice","Demon Sirius",363
S07755,"Returning Sea (Mix 49)","Climax Beat",169
S07756,"Screaming Rose","Lil Wave",267
S07757,"Drifting Forest of Dust","Frost Zephyr",336
S07758,"Dancing Beat of Voice","Captain Zephyr",313
S07759,"Dreaming Of the Soul","Brother Rhythm",299
S07760,"Drifting Valley (Mix 35)","Captain Blaze",365
S07761,"Dancing With the Page (Mix 71)","Lil Echo",299
S07762,"Waiting River of River","The Phantom",348
S07763,"Losing the Bridge (Mix 12)","The Shadow",249
S07764,"Listening To the Street (Mix 56)","Solaris Glide",235
S07765,"Wild Water of Gold","MC Pulse",159
S07766,"Wild River (Mix 49)","Solaris Vibe",176
S07767,"Flying Above the Night","Sirius Climax",437
S07768,"Waiting For the Ice (Mix 64)","Sonic Solaris",204
S07769,"Sunrise Soul of Dream","Cascade Harmony",470
S07770,"Neon Door (Mix 73)","Drift Fable",367
S07771,"Solar Picture (Mix 69)","Frequency Apex",233
S07772,"Whispering Dust (Mix 55)","Big Nova",154
S07773,"Lost Forest","Demon Sirius",295
S07774,"Cloudy Forest (Mix 78)","Specter Sirius",138
S07775,"Sunrise Silver","Lyra Luna",455
S07776,"Remembering the Glass (Mix 28)","Cascade Nova",325
S07777,"Stormy Wind of House","Wave Drift",221
S07778,"Ethereal Voice in the Glass","Climax Ghost",129
S07779,"Returning Whisper of Silence","DJ Sonic",462
S07780,"Glowing Echo of Wind","The Myth",285
S07781,"Crying Melody of Sun","Sir Cascade",281
S07782,"Cloudy Valley (Mix 67)","Vibe Frost",455
S07783,"Crying Sky (Mix 60)","Lil Lyra",179
S07784,"Rainy Sound in the Stone","The Zenith",251
S07785,"Dreaming Of the Echo (Mix 32)","Nova Beat",466
S07786,"Running Through the Dream (Mix 89)","Lady Demon",248
S07787,"Electric Rain of Star","Sirius Ghost",334
S07788,"Infinite Illusion of Light","Lil Lyra",320
S07789,"Forgotten Voice in the Road","Ghost Pulse",309
S07790,"Chasing the Day (Mix 33)","DJ Sonic",397
S07791,"Laughing City of Mountain","Agent Storm",217
S07792,"Hidden Melody","Melody Demon",208
S07793,"Dying Light of Flower","Climax Ghost",251
S07794,"Crimson Dust","Lil Pulse",267
S07795,"Broken Rose of Wind","Solaris Zenith",142
S07796,"Stormy River in the Phoenix","Lady Demon",267
S07797,"Dark Gold of Soul","Harmony Zenith",174
S07798,"Hiding From the Rose (Mix 13)","Echo Phoenix",344
S07799,"Hiding From the Rose (Mix 54)","Apex Phantom",373
S07800,"Wild Shadow of Flower","Ghost Zephyr",120
S07801,"Solar Street of Gate","Brother Specter",402
S07802,"Singing Under the Page (Mix 84)","Sir Spirit",403
S07803,"Sunrise Gold in the Water","Rhythm Myth",382
S07804,"Summer Soul (Mix 12)","Lil Ghost",408
S07805,"Hidden Water in the Firefly","Vega Phantom",210
S07806,"Summer Room","Solaris Zenith",360
S07807,"Empty Story of Ice","DJ Phantom",345
S07808,"Watching the Sun (Mix 40)","Sir Crest",158
S07809,"Haunted River in the Mountain","Sonic Apex",203
S07810,"Running Wave of Stone","Sir Pulse",426
S07811,"Winter Silver of Bridge","Sister Drift",419
S07812,"Broken Word (Mix 5)","Angel Luna",127
S07813,"Hiding From the Street (Mix 45)","Harmony Solaris",163
S07814,"Forgetting the Bridge (Mix 43)","Apex Cascade",349
S07815,"Finding Wind (Mix 26)","Lil Blaze",430
S07816,"Dark Phoenix of Shadow","Captain Apex",221
S07817,"Sweet Flower","The Nova",347
S07818,"Midnight River of Book","Phoenix Crest",139
S07819,"Windy Story in the Rain","Big Crest",199
S07820,"Starry City of Forest","Lil Climax",169
S07821,"Searching Melody in the Echo","Drift Phoenix",210
S07822,"Bitter Ocean","Lady Vega",226
S07823,"Crying Dream in the Sun","Apex Spirit",227
S07824,"Running Voice of Storm","MC Lyra",147
S07825,"Dreamy Sound","Luna Beat",468
S07826,"Solar Rhythm","DJ Melody",462
S07827,"Empty House of Sound","Echo Phoenix",357
S07828,"Ocean City in the Silence","The Lyra",311
S07829,"Serene Light (Mix 8)","Phoenix Crest",259
S07830,"Singing Under the Road (Mix 50)","The Phoenix",265
S07831,"Sunrise Shadow","Brother Phoenix",420
S07832,"Dreamy Rose","The Phoenix",445
S07833,"Waiting For the Echo (Mix 9)","Vibe Zenith",354
S07834,"Listening To the Story (Mix 24)","DJ Drift",278
S07835,"Searching Illusion of Shadow","Sirius Ghost",215
S07836,"Losing the Door (Mix 95)","Lil Legend",309
S07837,"Stormy Fire in the House","Sister Melody",334
S07838,"Shadowy Day (Mix 95)","Demon Ghost",306
S07839,"Lunar Gate of Fire","MC Wave",249
S07840,"Stormy Town of Moon","Sir Harmony",366
S07841,"Faded Dust","Shadow Atlas",147
S07842,"Whispering Sun (Mix 21)","Apex Nova",248
S07843,"Haunted Firefly of Glass","Rhythm Beat",400
S07844,"Forgetting the Door (Mix 50)","Sir Fable",466
S07845,"Rainy Light of Window","Captain Shadow",387
S07846,"Serene Forest in the Wind","Blaze Apex",345
S07847,"Dancing Flower in the Road","Cascade Wave",464
S07848,"Neon City","Luna Lyra",480
S07849,"Screaming Road of Glass","Lady Shadow",467
S07850,"Chasing Voice of Soul","Climax Aero",320
S07851,"Neon Gold of Sun","Pulse Frost",212
S07852,"Autumn Light in the Tree","Solaris Lyra",450
S07853,"Wild Bridge of Firefly","Sir Crest",478
S07854,"Crying Mirror in the Mountain","Phantom Phoenix",375
S07855,"Running Through the Moon (Mix 36)","Sir Climax",411
S07856,"Laughing Mirror in the Word","The Aero",178
S07857,"Screaming Echo in the Page","Zephyr Glide",154
S07858,"Dancing With the Night (Mix 5)","Apex Cascade",329
S07859,"Dancing With the Rose (Mix 79)","MC Phantom",153
S07860,"Wild Glass of Night","Shadow Angel",202
S07861,"Screaming Glass","The Specter",252
S07862,"Infinite Silver (Mix 37)","The Aero",250
S07863,"Infinite Stone in the Firefly","Brother Rhythm",415
S07864,"Crimson Rose of Shadow","Lady Atlas",448
S07865,"Wild Ice of Day","Zephyr Specter",324
S07866,"Ethereal Rose in the Heart","MC Apex",165
S07867,"Watching the Road (Mix 52)","Sir Wave",213
S07868,"Listening To the Story (Mix 80)","The Phantom",253
S07869,"Cloudy Bridge in the Page","Frequency Apex",282
