id,title,artist,duration
S05291,"Singing Under the Echo (Mix 53)","Drift Echo",449
S05292,"Sunrise Rose of Story","Lil Sonic",409
S05293,"Stormy Door in the Page","Glide Climax",307
S05294,"Crimson Soul","Sir Cascade",300
S05295,"Chasing the Shadow (Mix 63)","Ghost Zephyr",382
S05296,"Spring Forest","Lil Legend",443
S05297,"Rainy Sea of Gold","Sir Frost",416
S05298,"Hiding From the Rose (Mix 31)","Aero Harmony",132
S05299,"Watching the Bridge","The Myth",421
S05300,"Singing Under the Wave","Spirit Tide",251
S05301,"Hiding From the Wave (Mix 98)","Demon Zephyr",423
S05302,"River Story of Dream","Sister Demon",218
S05303,"Windy Firefly (Mix 57)","DJ Blaze",353
S05304,"Serene Window (Mix 72)","Specter Solaris",303
S05305,"Luminous Picture","The Cascade",332
S05306,"Crystal Town of Line","Lady Phantom",347
S05307,"Ethereal Shadow of Gate","Crest Vega",337
S05308,"Luminous Whisper (Mix 59)","Lil Frequency",227
S05309,"Velvet Flower","Solaris Zenith",330
S05310,"Rising Path","Lil Sirius",419
S05311,"Bitter Valley of Forest","Sirius Specter",227
S05312,"Summer River of Whisper","Legend Orion",162
S05313,"Finding the Road (Mix 66)","The Luna",432
S05314,"Waiting For the Word (Mix 3)","Shadow Atlas",123
S05315,"Stormy Story of Firefly","Tide Apex",414
S05316,"Hidden Valley of Mountain","Phantom Rhythm",247
S05317,"Neon Voice of Wave","The Luna",444
S05318,"Crimson Mountain in the Whisper","Blaze Lyra",174
S05319,"Watching the Ocean (Mix 94)","Ghost Zephyr",464
S05320,"Whispering Firefly of Fire","Frequency Atlas",313
S05321,"Crying Dream in the Heart","Cascade Vibe",450
S05322,"Midnight Rhythm of Ice","Rhythm Beat",454
S05323,"Rainy River","Agent Pulse",153
S05324,"Singing Under the Moon (Mix 10)","Sonic Fable",275
S05325,"Listening To the Firefly (Mix 68)","Glide Apex",434
S05326,"Wild Rose in the Heart","Legend Vibe",471
S05327,"Sweet Silver of Gate","Apex Shadow",251
S05328,"Broken Rose in the Song","Sir Cascade",351
S05329,"Silver Dream","DJ Sonic",378
S05330,"Watching the Fire (Mix 51)","The Phoenix",129
S05331,"Luminous Rhythm (Mix 19)","Sister Phoenix",331
S05332,"Finding the Firefly (Mix 73)","Agent Storm",437
S05333,"Remembering the Garden (Mix 57)","Captain Phoenix",213
S05334,"Dancing Glass of Echo","The Luna",417
S05335,"Living Window in the Road","Lyra Lyra",141
S05336,"Spring Water in the Phoenix","Angel Storm",280
S05337,"Screaming Song in the Sky","Captain Blaze",325
S05338,"Silver Tree of Bridge","Cascade Angel",181
S05339,"Sweet Room (Mix 48)","DJ Echo",204
S05340,"Stormy Street of Window","The Phantom",340
S05341,"Haunted House","Brother Specter",235
S05342,"Dancing With the Word","Big Aero",206
S05343,"Dark Day","Storm Drift",427
S05344,"Serene Gold in the Wind","Beat Phantom",247
S05345,"Watching the Melody","Apex Shadow",177
S05346,"Flying Above the Page","Orion Lyra",232
S05347,"Dancing With the Sky (Mix 40)","Vega Frequency",205
S05348,"Silver Window of Heart","The Echo",258
S05349,"Neon Tree of Dust","Melody Crest",442
S05350,"Chasing Ice in the Book","Apex Shadow",222
S05351,"Mystic Ocean","Storm Atlas",424
S05352,"Dreaming Of the Rain (Mix 33)","Echo Phoenix",372
S05353,"Remembered Story of Phoenix","Sister Apex",235
S05354,"Searching Story","Brother Angel",308
S05355,"Laughing Wind in the Whisper","Apex Vibe",203
S05356,"Glowing Rose in the Rain","Shadow Atlas",146
S05357,"Screaming Door in the City","Vibe Frost",216
S05358,"Ethereal Window in the Silver","Phantom Echo",466
S05359,"Hiding From the Whisper (Mix 87)","Lil Echo",362
S05360,"Chasing Valley of Illusion","The Spirit",310
S05361,"Winter Wind in the Mountain","Sister Melody",195
S05362,"Velvet Night in the Silver","Phantom Echo",171
S05363,"Drifting Sun in the Illusion","Lady Sirius",258
S05364,"Running Through the Tree","The Drift",181
S05365,"Hidden Rhythm in the Voice","Beat Phantom",362
S05366,"Haunted Rain of River","Sir Aero",335
S05367,"Drifting Door (Mix 78)","Lady Phantom",383
S05368,"Sailing On the Water (Mix 67)","Aero Zenith",291
S05369,"Faded Mirror in the Book","Angel Rhythm",445
S05370,"Singing Sound in the River","Storm Wave",199
S05371,"Lost Silver (Mix 44)","Sonic Vibe",181
S05372,"Forgetting the Melody (Mix 61)","Lady Nova",469
S05373,"Silver Light (Mix 72)","The Luna",228
S05374,"Drifting Day of Sea","Demon Harmony",364
S05375,"Mystic Whisper of Dream","Specter Solaris",336
S05376,"Sunset Road of Illusion","The Phantom",227
S05377,"Singing Under the Sound (Mix 38)","Ghost Ghost",337
S05378,"Windy Silver of Beat","Captain Frequency",286
S05379,"Dreaming Of the Picture (Mix 8)","Climax Ghost",240
S05380,"Hiding From the Glass","The Phantom",147
S05381,"Waiting Flower (Mix 30)","Big Beat",251
S05382,"Flying Above the Rhythm (Mix 4)","Phantom Harmony",164
S05383,"Cosmic Tree of City","The Zephyr",318
S05384,"Dark Glass in the Valley","Wave Storm",253
S05385,"Crying Sound of Line","Lil Blaze",413
S05386,"Lost Town in the Silver","Sister Atlas",147
S05387,"Glowing Wind","Lil Sirius",134
S05388,"Midnight Silence","Fable Specter",355
S05389,"Hiding From the Picture (Mix 59)","Phoenix Crest",185
S05390,"Luminous Silver (Mix 50)","Lil Pulse",411
S05391,"Flying Above the Illusion","Tide Apex",160
S05392,"Hiding From the Picture (Mix 74)","Sonic Apex",342
S05393,"Summer Moon of Line","The Echo",228
S05394,"Crystal Sun of Glass","Captain Lyra",444
S05395,"Forgetting the Dust (Mix 54)","Nova Phoenix",353
S05396,"Sailing On the Illusion (Mix 50)","Luna Zenith",478
S05397,"Glowing Window","Harmony Frequency",474
S05398,"Laughing Valley in the Fire","Lil Blaze",141
S05399,"Crying Sea in the Door","Big Aero",286
S05400,"Summer Town in the Dream","DJ Zephyr",303
S05401,"Flying Glass in the Rose","Phantom Phoenix",126
S05402,"Crimson Line","Melody Luna",153
S05403,"Dancing Picture in the Rain","Cascade Nova",449
S05404,"Sweet Sea of Whisper","Agent Pulse",381
S05405,"Midnight Melody","Sir Phoenix",210
S05406,"Flying River of Bridge","Agent Atlas",339
S05407,"Chasing Beat (Mix 81)","Drift Harmony",318
S05408,"Drifting Town of Sound","Solaris Ghost",422
S05409,"Losing the Phoenix (Mix 82)","Apex Cascade",379
S05410,"Flying Above the Flower","Lil Glide",170
S05411,"Forgetting the Wave","Shadow Angel",441
S05412,"Walking In the Echo (Mix 85)","Lady Vega",377
S05413,"Flying Night in the Page","Frequency Cascade",255
S05414,"Cloudy Gate","Wave Apex",185
S05415,"Dancing Song in the Room","The Frequency",457
S05416,"Singing Star","DJ Demon",438
S05417,"Secret River of Story","The Orion",258
S05418,"Bitter Firefly in the Sun","Lady Blaze",240
S05419,"Running Through the Mountain (Mix 75)","Crest Vibe",163
S05420,"Sailing On the Dust","Cascade Aero",421
S05421,"Starry Wind","Glide Climax",181
S05422,"Crystal Sky in the Flower","MC Harmony",217
S05423,"Searching Melody","Zephyr Pulse",343
S05424,"Sweet Stone in the House","Glide Climax",193
S05425,"Glowing Path of Water","Cascade Angel",161
S05426,"Dreamy Door (Mix 90)","Agent Storm",179
S05427,"Walking In the Shadow (Mix 36)","Sirius Vega",169
S05428,"Chasing Gate","Shadow Angel",137
S05429,"Losing the Bridge (Mix 76)","MC Pulse",217
S05430,"Flying Above the Ice (Mix 74)","Nova Phoenix",338
S05431,"Finding the Flower (Mix 27)","The Rhythm",134
S05432,"Finding the Voice (Mix 13)","Big Aero",399
S05433,"Sweet Rain in the Day","DJ Legend",145
S05434,"Finding Sound of Dream","DJ Demon",455
S05435,"Infinite Beat (Mix 29)","Agent Phoenix",328
S05436,"Waiting Rose in the Page","Vega Lyra",376
S05437,"Cosmic Word in the Gold (Mix 37)","Brother Frequency",120
S05438,"Shadowy Town of Street","Spirit Tide",420
S05439,"Running Through the Sky (Mix 1)","Sister Harmony",357
S05440,"Burning Ice in the Heart","Climax Zenith",129
S05441,"Wild Word of Bridge","Storm Atlas",176
S05442,"Chasing the Ice (Mix 10)","The Beat",272
S05443,"Broken Sky of Silence","The Phantom",356
S05444,"Singing Under the Flower (Mix 10)","Frequency Zenith",335
S05445,"Flying Glass of Picture","Melody Phoenix",237
S05446,"Chasing Gold of Wave","The Beat",325
S05447,"Running Door of Bridge","Captain Rhythm",286
S05448,"Crystal Night","Frost Orion",274
S05449,"Singing Under the Storm (Mix 49)","Apex Vibe",353
S05450,"Spring House in the Mountain","Orion Lyra",435
S05451,"Searching Wind in the Firefly","Agent Sirius",336
S05452,"Solar Sea (Mix 75)","Demon Echo",451
S05453,"Singing Under the Night (Mix 40)","Agent Sonic",308
S05454,"Watching the Town (Mix 73)","Angel Rhythm",473
S05455,"Drifting Tree in the City","Lil Rhythm",401
S05456,"Electric Illusion in the Voice","Tide Apex",203
S05457,"Haunted Path in the Silence","Sir Vibe",396
S05458,"Remembered Sound","Myth Demon",311
S05459,"Dancing Dream of House","MC Apex",269
S05460,"Cloudy Silver of Mountain","The Frost",213
S05461,"Bitter Beat in the House","Phoenix Pulse",426
S05462,"Velvet Water of Mirror","Echo Beat",195
S05463,"Velvet Water in the Rain","Angel Rhythm",280
S05464,"Empty Rose in the Mirror","Big Orion",416
S05465,"Cosmic Bridge","Brother Beat",130
S05466,"Forgotten Street","The Glide",154
S05467,"Listening To the Book (Mix 60)","Sir Glide",439
S05468,"Sunset Ocean in the Tree","Drift Harmony",209
S05469,"Dying Picture in the Flower","Harmony Apex",284
S05470,"Electric Night of Room","Cascade Wave",432
S05471,"Losing the Moon","Phantom Rhythm",413
S05472,"Cosmic Dust (Mix 50)","Lil Nova",401
S05473,"Sunrise Tree","Drift Fable",453
S05474,"Forgetting the Moon (Mix 17)","The Sirius",275
S05475,"Hiding From the Silver (Mix 83)","Climax Aero",331
S05476,"Stormy Road","The Beat",178
S05477,"Forgotten Mirror in the Day","Lyra Lyra",368
S05478,"Neon Rain of Phoenix","Frequency Atlas",430
S05479,"River Song in the Forest","DJ Apex",264
S05480,"Chasing Path in the Wind","Tide Frost",311
S05481,"Secret Rose","Pulse Frost",141
S05482,"Silent Fire","DJ Storm",178
S05483,"Finding the Voice (Mix 49)","Sister Climax",306
S05484,"Bitter Dream (Mix 65)","The Climax",141
S05485,"Infinite Soul","Sister Beat",242
S05486,"Forgetting the Star (Mix 19)","Apex Phantom",316
S05487,"Flying Above the Silver (Mix 57)","Rhythm Glide",174
S05488,"Dark Bridge","Echo Phoenix",345
S05489,"Windy Light of Whisper","The Climax",177
S05490,"Listening To the Door (Mix 10)","DJ Demon",410
S05491,"Laughing Valley","Sir Echo",413
S05492,"Dreaming Of the Street (Mix 31)","Spirit Blaze",447
S05493,"Glowing Picture of Moon","Brother Phoenix",234
S05494,"Windy Road of Night","Demon Harmony",443
S05495,"Dying Wave of Firefly","Lady Shadow",290
S05496,"Crying Window of Rain","Solaris Atlas",370
S05497,"Serene Town in the Day","Glide Drift",336
S05498,"Windy Heart in the Glass","Atlas Luna",385
S05499,"Autumn Echo in the Tree","Sirius Ghost",311
S05500,"Listening To the Mirror","Sir Pulse",246
S05501,"Flying Above the Fire","Climax Zenith",259
S05502,"Light Glass of Wave","Orion Orion",161
S05503,"Lunar Word in the Gate","The Zephyr",228
S05504,"Laughing Light in the Flower","Spirit Specter",280
S05505,"Stormy Path of Song","Sirius Shadow",374
S05506,"Winter Rain of Illusion","Sir Fable",205
S05507,"Running Rhythm (Mix 40)","Sir Frequency",470
S05508,"Laughing Wind of Mountain","Drift Phoenix",222
S05509,"Summer Echo in the Tree","Rhythm Sirius",447
S05510,"Crystal Valley in the Silver","MC Zenith",268
S05511,"Sailing On the Fire (Mix 80)","Sir Aero",165
S05512,"Rising Sky (Mix 69)","Rhythm Myth",431
S05513,"Haunted Silver in the House","Lady Aero",165
S05514,"Whispering Window","The Lyra",312
S05515,"Flying Above the Garden (Mix 26)","Agent Wave",438
S05516,"Sunrise Firefly in the Window","The Myth",384
S05517,"Finding the Page (Mix 36)","Sister Melody",260
S05518,"Silver Whisper in the Town","Harmony Frequency",148
S05519,"Burning Wave of Fire","Wave Apex",448
S05520,"Hidden Illusion in the Story","Lil Demon",451
S05521,"Autumn Firefly in the Word","The Drift",472
S05522,"Drifting Sound of Word","Vibe Vibe",157
S05523,"Autumn Forest","Sir Lyra",434
S05524,"Light Rose in the Valley","Demon Harmony",188
S05525,"Autumn Song in the Rose","Rhythm Lyra",293
S05526,"Returning Sound in the Room","Frequency Cascade",364
S05527,"Searching Dream in the Ice","Lil Legend",312
S05528,"Solar Street of Heart","Storm Frost",185
S05529,"Stormy Line (Mix 57)","Vibe Phantom",239
S05530,"Secret Echo of Sky","Orion Lyra",442
S05531,"Living Mirror of Silence","Specter Sirius",313
S05532,"Waiting Moon in the Sound","Apex Wave",407
S05533,"Winter Fire in the Echo","Sir Storm",384
S05534,"Silent Firefly of Book","MC Harmony",349
S05535,"Light Rhythm of Gold","Solaris Glide",468
S05536,"Screaming Rain in the Dream","The Zephyr",292
S05537,"Hiding From the City (Mix 4)","Glide Climax",468
S05538,"Singing Under the Door (Mix 36)","Pulse Orion",426
S05539,"Flying Above the Valley (Mix 51)","Solaris Atlas",349
S05540,"Forgetting the Day","Sister Atlas",410
S05541,"Running Through the Wave (Mix 5)","The Myth",165
S05542,"Winter Phoenix of Dream","Captain Fable",234
S05543,"Singing Under the Street (Mix 76)","Rhythm Myth",199
S05544,"Dreamy Gate in the Soul","Luna Zenith",142
S05545,"Glowing Book in the Rose","Apex Spirit",429
S05546,"Luminous Page in the Sky","Agent Phantom",388
S05547,"Stormy Page (Mix 40)","Captain Phoenix",226
S05548,"Neon Shadow of Echo","Nova Beat",125
S05549,"Dreamy Story of Street","Lady Wave",147
S05550,"Sailing On the Book (Mix 78)","The Myth",324
S05551,"Sailing On the Melody (Mix 75)","Sir Phoenix",313
S05552,"Listening To the Valley (Mix 29)","Captain Fable",456
S05553,"Shadowy River in the Flower","Frost Fable",405
S05554,"Watching the Phoenix","Legend Orion",447
S05555,"Running Through the Rhythm","Sir Aero",352
S05556,"Flying Heart in the Sky","Sir Harmony",369
S05557,"Shadowy Valley","Vibe Vibe",357
S05558,"Running Firefly in the Soul","Harmony Frequency",328
S05559,"Hiding From the Forest (Mix 69)","Agent Ghost",163
S05560,"Dreaming Of the Dust (Mix 39)","Sir Cascade",226
S05561,"Neon Book (Mix 76)","Sirius Vega",306
S05562,"Forgetting the Heart (Mix 95)","Nova Vibe",277
S05563,"Leaving Story","Myth Atlas",353
S05564,"Serene Flower","The Crest",445
S05565,"Lunar Bridge in the Dust","Orion Orion",399
S05566,"Chasing House in the Echo","Solaris Glide",451
S05567,"Glowing Ocean","Aero Zenith",268
S05568,"Watching the Stone (Mix 50)","Lyra Glide",372
S05569,"Glowing Bridge in the Song","Crest Orion",262
S05570,"Dreaming Of the Rain (Mix 65)","Demon Ghost",370
S05571,"Flying Above the Window (Mix 1)","Big Cascade",373
S05572,"Windy Rain of Dust","The Lyra",480
S05573,"Flying Water of Tree","Agent Ghost",330
S05574,"Silent Light","Lady Glide",293
S05575,"Bitter Stone (Mix 71)","The Tide",447
S05576,"Crystal Street","The Frequency",366
S05577,"Fallen Illusion (Mix 21)","Solaris Phantom",122
S05578,"Rising Word of Water","Lil Melody",157
S05579,"Lunar Window in the Ice","Vibe Frost",408
S05580,"Dancing Rhythm in the City","Ghost Zephyr",447
S05581,"Flying Line in the Ice","Tide Frost",246
S05582,"Infinite Dream in the Picture","Rhythm Cascade",215
S05583,"Flying Dust of Melody","Storm Specter",135
S05584,"Losing the Whisper (Mix 12)","Beat Harmony",358
S05585,"Singing Illusion in the House","DJ Wave",470
S05586,"Silver Illusion in the Flower","Big Cascade",398
S05587,"Sunrise Glass","Sister Phoenix",124
S05588,"Bitter Light in the Sound","The Zenith",189
S05589,"Starry Fire in the Mountain","Solaris Harmony",202
S05590,"Walking In the Star (Mix 98)","Sister Luna",237
S05591,"Autumn Gate in the Glass","The Tide",296
S05592,"Burning Valley of Ice","Captain Phantom",213
S05593,"Searching Town","Lady Climax",427
S05594,"Running House in the Night","Rhythm Myth",214
S05595,"Forgetting the House (Mix 94)","Captain Sirius",131
S05596,"Running Wave","Storm Atlas",301
S05597,"Starry Door (Mix 23)","Glide Apex",251
S05598,"Shadowy Path","Drift Harmony",268
S05599,"Flying Stone of Phoenix","Sir Climax",471
S05600,"Walking In the Forest (Mix 53)","Big Orion",309
S05601,"Rising Night (Mix 5)","Big Melody",134
S05602,"Infinite Stone","Sister Aero",331
S05603,"Summer Window of Forest","Agent Shadow",348
S05604,"Sailing On the Echo (Mix 97)","DJ Sonic",180
S05605,"Crying Tree in the Street","MC Wave",355
S05606,"Drifting Flower of Light","Atlas Rhythm",452
S05607,"Sailing On the Window (Mix 11)","Storm Glide",244
S05608,"Sailing On the Ocean (Mix 37)","Pulse Orion",433
S05609,"Autumn Page","Cascade Angel",461
S05610,"Crystal Star","Sister Beat",426
S05611,"Electric Gate of Song","Luna Zenith",166
S05612,"Windy Fire in the Heart","The Vibe",454
S05613,"Cloudy Gold in the Phoenix","Beat Apex",392
S05614,"Chasing the Town (Mix 73)","Lady Wave",273
S05615,"Velvet Path (Mix 99)","Sister Harmony",280
S05616,"Waiting Soul","Apex Beat",477
S05617,"River Garden","Beat Harmony",267
S05618,"Silver Room in the Line","DJ Frequency",245
S05619,"Whispering Beat","Lil Blaze",469
S05620,"Running Page","Brother Storm",463
S05621,"Autumn Beat of Dream","Vibe Phantom",429
S05622,"Crimson Shadow in the Room","Sir Frequency",477
S05623,"Dying Line of Star","Lady Solaris",382
S05624,"Hiding From the Valley","Pulse Orion",479
S05625,"Sunset Tree","Climax Aero",120
S05626,"Light Silence","Phoenix Solaris",275
S05627,"Summer Room of Rhythm","Lil Storm",196
S05628,"Secret Moon of Ice","DJ Wave",418
S05629,"Starry Valley of Water","Sister Drift",128
S05630,"Crimson Night","Spirit Drift",226
S05631,"Lunar Road","Lil Vega",393
S05632,"Forgotten Story of Echo","MC Legend",363
S05633,"Screaming Water in the Sky","The Zenith",155
S05634,"Starry Rhythm of Silence","The Blaze",299
S05635,"Crying Sun in the Word","Lady Shadow",293
S05636,"Empty Light","The Aero",133
S05637,"Chasing the Moon (Mix 32)","The Phoenix",144
S05638,"Velvet Street of Tree","MC Legend",464
S05639,"Ocean Tree","Lil Glide",155
S05640,"Haunted Light","Captain Wave",251
S05641,"Flying Above the Tree","Vibe Phantom",415
S05642,"Starry Forest of Book","Agent Storm",306
S05643,"Dreaming Of the Valley (Mix 89)","Atlas Rhythm",214
S05644,"Infinite Street","The Apex",367
S05645,"Golden Shadow","Zephyr Specter",188
S05646,"Finding the River (Mix 14)","Phoenix Crest",429
S05647,"Dreaming Of the Rain (Mix 53)","Brother Rhythm",279
S05648,"River Gold of Night","Lady Phoenix",403
S05649,"Windy Shadow in the Storm","Sir Frequency",430
S05650,"Remembered Shadow","Brother Apex",260
S05651,"Sweet Wind","Sister Aero",383
S05652,"Watching the Glass","Ghost Specter",261
S05653,"Golden Valley in the Light","Sister Drift",246
S05654,"Flying Firefly","DJ Orion",132
S05655,"Finding the Star (Mix 75)","DJ Phantom",282
S05656,"Crystal Night of Street","Apex Shadow",277
S05657,"Screaming Stone in the Rose","MC Wave",402
S05658,"Wild Song","Pulse Sirius",214
S05659,"Dancing With the Book","DJ Demon",253
S05660,"River Dust of Mountain","The Atlas",358
S05661,"Cloudy Phoenix of Rain","Apex Solaris",188
S05662,"Fallen Door in the Soul","MC Pulse",354
S05663,"Finding Storm of Silence","Sister Phoenix",362
S05664,"Stormy Gate in the Wind","Sir Spirit",316
S05665,"Drifting Town of Rhythm","MC Wave",171
S05666,"Waiting For the Street (Mix 25)","Beat Phantom",139
S05667,"Dreamy Silence","Lady Climax",377
S05668,"Screaming Town of Mirror","Specter Solaris",442
S05669,"Forgotten Beat","Luna Zenith",285
S05670,"Sunset Ocean in the Song","Captain Frequency",442
S05671,"Silver Storm of Story","Sister Drift",408
S05672,"Solar Mountain in the Silver","Nova Phoenix",209
S05673,"Lunar Town","Brother Phantom",213
S05674,"Summer Echo in the Illusion","Storm Atlas",218
S05675,"Dreamy Silver in the Town","Sir Glide",376
S05676,"Secret Soul of Forest","Sister Climax",192
S05677,"Remembering the Star (Mix 7)","Vega Lyra",456
S05678,"Watching the Moon (Mix 7)","Big Aero",406
S05679,"Dancing River of Town","DJ Sirius",390
S05680,"Searching Sea in the Stone","Drift Fable",218
S05681,"Stormy Picture in the Mirror","Nova Vibe",415
S05682,"Hiding From the Dream (Mix 51)","Beat Apex",225
S05683,"Dancing Gold in the Silver","DJ Phantom",248
S05684,"Leaving Sun of Night","Cascade Angel",277
S05685,"Burning Page in the Firefly","Crest Crest",273
S05686,"Sailing On the Song (Mix 70)","Lil Rhythm",186
S05687,"Solar Firefly","Brother Angel",295
S05688,"Watching the Storm (Mix 59)","The Glide",295
S05689,"Stormy Voice of Silence","Lil Harmony",360
S05690,"Lunar Sea of River","The Pulse",237
S05691,"Hiding From the Word (Mix 62)","Sir Frost",211
S05692,"Flying Star","Solaris Harmony",191
S05693,"Solar Forest of Rain","Harmony Frequency",231
S05694,"Light City of Word","Angel Storm",265
S05695,"Burning Wave","Demon Crest",274
S05696,"Serene Rhythm in the Picture","The Drift",370
S05697,"Wild Moon in the Mirror","Orion Lyra",393
S05698,"Running Road","Vibe Frost",309
S05699,"Sailing On the Door","Sir Solaris",124
S05700,"Shadowy Storm in the Moon","The Apex",406
S05701,"River Garden in the Dust","Specter Zephyr",223
S05702,"Windy Ocean","Brother Frequency",122
S05703,"Lunar Mountain of Garden","Atlas Sonic",261
S05704,"Dancing With the Rain","Brother Angel",296
S05705,"Luminous Mountain (Mix 79)","The Cascade",350
S05706,"Dark Whisper in the Silence","Captain Echo",226
S05707,"Listening To the Echo (Mix 3)","Demon Vibe",240
S05708,"Serene Wind of Book","Sir Pulse",451
S05709,"Fallen Ice","Apex Sirius",238
S05710,"Forgotten Picture in the Ice","Sir Sonic",437
S05711,"Listening To the Mountain (Mix 97)","Apex Cascade",350
S05712,"Neon Stone of Tree","Big Myth",141
S05713,"Cosmic Phoenix of Garden","MC Lyra",289
S05714,"Midnight Ocean in the Storm","The Harmony",395
S05715,"Rising Shadow","Lil Lyra",438
S05716,"Stormy Firefly in the Sky","Big Vibe",140
S05717,"Dancing With the Melody (Mix 43)","MC Zenith",401
S05718,"Listening To the Story (Mix 39)","Aero Harmony",424
S05719,"Spring Moon in the Firefly","Demon Vibe",364
S05720,"Sweet Day","Solaris Atlas",225
S05721,"Solar Rose of Night","The Vibe",248
S05722,"Sweet Day in the Shadow","Specter Orion",280
S05723,"Chasing Sound of Stone","Captain Aero",343
S05724,"Forgetting the Night (Mix 9)","Sirius Climax",354
S05725,"Losing the Tree (Mix 33)","Apex Solaris",309
S05726,"River Dream","DJ Melody",145
S05727,"Spring Song in the River","Agent Shadow",425
S05728,"Forgotten Star of Silence","Lady Phantom",354
S05729,"Lost Door of Page","Fable Specter",149
S05730,"Infinite Silver in the Wind","Lil Echo",463
S05731,"Sunset Path of Soul","Agent Sonic",152
S05732,"Empty Sun of Gold","Sir Shadow",369
S05733,"Bitter Rain","Lil Glide",172
S05734,"Silver Water in the Fire","Cascade Vega",362
S05735,"Windy Silence of Town","Captain Drift",337
S05736,"Flying Above the Firefly (Mix 84)","Climax Zenith",328
S05737,"Windy Heart in the Illusion","The Pulse",301
S05738,"Dancing Voice of Line","Angel Rhythm",396
S05739,"Stormy Mountain (Mix 66)","Climax Spirit",438
S05740,"Watching the Shadow","Storm Atlas",248
S05741,"Flying Above the Water (Mix 35)","Ghost Pulse",356
S05742,"Walking In the Forest (Mix 89)","Apex Demon",450
S05743,"Silent Stone in the Firefly","Phoenix Pulse",399
S05744,"Stormy River","MC Apex",408
S05745,"Dancing Sea","Cascade Vibe",255
S05746,"Hiding From the Wave (Mix 96)","Vibe Zenith",409
S05747,"Chasing Valley in the Sky","Captain Rhythm",432
S05748,"Remembering the Garden (Mix 59)","Rhythm Cascade",285
S05749,"Rainy Whisper of Stone","Phantom Phoenix",477
S05750,"Walking In the Star (Mix 94)","Rhythm Myth",315
S05751,"Remembering the Sound (Mix 12)","Spirit Blaze",284
S05752,"Chasing the Picture (Mix 75)","Drift Cascade",267
S05753,"Remembering the Book","Solaris Glide",410
S05754,"Losing the Gold (Mix 57)","Apex Phantom",159
S05755,"Lost Room in the Rain","Frequency Cascade",125
S05756,"Bitter Room of Whisper","Lil Climax",386
S05757,"Drifting Book in the Sea","Agent Zenith",368
S05758,"Infinite Forest","Big Cascade",401
S05759,"Stormy Ice in the Word","The Fable",396
S05760,"Crimson Whisper of Light","Solaris Zenith",143
S05761,"Faded Firefly in the Moon","Captain Ghost",364
S05762,"Watching the Water (Mix 20)","MC Zenith",124
S05763,"Dancing With the Soul (Mix 68)","Rhythm Cascade",160
S05764,"Spring Mirror of Song","Beat Phantom",288
S05765,"Ethereal Bridge in the Song","Frost Zephyr",183
S05766,"Ocean Ice in the Echo","Sonic Fable",233
S05767,"Ocean Heart of Gold","MC Orion",236
S05768,"Singing Under the Silence (Mix 12)","Apex Beat",349
S05769,"Watching the Room (Mix 32)","Big Myth",232
S05770,"Bitter Valley","Climax Zenith",348
S05771,"Midnight Sound in the Night","Sir Frost",137
S05772,"Serene Sound of House","Apex Phantom",364
S05773,"Running Through the Tree (Mix 72)","The Wave",371
S05774,"Walking In the Sky","Brother Frequency",385
S05775,"Summer Wind in the Soul","Apex Demon",410
S05776,"Haunted Water","MC Zenith",207
S05777,"Haunted Wind","Lady Phantom",221
S05778,"Ethereal Mountain in the Star","Agent Vega",232
S05779,"Crying Flower","Sir Solaris",473
S05780,"Dancing Stone in the Star","Legend Orion",438
S05781,"Singing Storm in the Heart","Nova Vibe",272
S05782,"Rainy Wind in the Light","Agent Zenith",326
S05783,"Leaving Line of Rhythm","Cascade Wave",306
S05784,"Electric Window of Rose","Solaris Vibe",357
S05785,"Crystal Path of Mountain","Lady Solaris",447
S05786,"Flying Above the Stone (Mix 27)","Sir Lyra",309
S05787,"Dancing Silence","Beat Phantom",477
S05788,"Dreaming Of the Book (Mix 33)","Sister Ghost",429
S05789,"Rising Rhythm of Storm","Drift Cascade",362
S05790,"Running Word of Door","Storm Atlas",221
S05791,"Searching Word of Dream","DJ Ghost",414
S05792,"Ocean Soul in the House","The Aero",376
S05793,"Walking In the Wave (Mix 24)","Lil Legend",439
S05794,"Electric Wind","MC Pulse",251
S05795,"Sailing On the Water (Mix 17)","Lil Wave",248
S05796,"Running Stone in the Heart","Frost Fable",223
S05797,"Fallen Room","Captain Blaze",441
S05798,"Serene Gold (Mix 64)","Frequency Atlas",344
S05799,"Sailing On the Door (Mix 36)","Angel Wave",271
S05800,"Hiding From the Silence (Mix 75)","Agent Ghost",141
S05801,"Chasing Ice (Mix 51)","Lady Phoenix",362
S05802,"Neon Mountain in the Moon","Sir Cascade",428
S05803,"Forgotten Heart","Crest Solaris",365
